uniqueid,year,incumbent_party_inafed,incumbent_candidate_inafed
14053,2015,COAL.,C. JUAN ALBERTO MARQUEZ DE ANDA
14053,2018,COAL.,C. TECUTLI JOSE GUADALUPE GOMEZ VILLALOBOS
14053,2021,PMC,LIC. TECUTLI JOSE GUADALUPE GOMEZ VILLALOBOS
14054,1992,PRI,LIC. JOEL RICO PIÑA
14054,1995,PRI,DR. DANIEL RAMIREZ SANCHEZ
14054,1998,PRD,LIC. DAVID MICHEL CAMARENA
14054,2000,PAN,C. JOSE GUADALUPE CORONA CHAVEZ
14054,2004,PRI,DR. DANIEL RAMIREZ SANCHEZ
14054,2007,PRI,C. JAIME HERNANDEZ CAMACHO
14054,2009,PAN,C. JOSE GUADALUPE CORONA CHAVEZ
14054,2012,PRD,C. ABEL TORRES ZEPEDA
14054,2015,PRD,C. ROBERTO DURAN MICHEL
14054,2018,COAL.,C. DAVID MICHEL CAMARENA
14054,2021,MORENA,C. NELSON GONZALEZ FIGUEROA
14055,1992,PAN,DR. SALVADOR AVILA LORETO
14055,1995,PAN,ARQ. J. DE JESUS RUBEN ARCE VELADOR
14055,1998,PRI,LIC. JUAN MANUEL OCHOA ORNELAS
14055,2000,PRI,C. JOSE ROSARIO GARCIA ROSALES
14055,2004,PAN,C. ARTURO ASCENCIO CECEÑA
14055,2007,PRI,C. GONZALO BAÑUELOS RIESTRA
14055,2009,PAN,LIC. MARIA DE LOS DOLORES JUAREZ ACEVEDO
14055,2012,CPJ,C. RAFAEL PONCE LOPEZ
14055,2015,PRI,C. FABIOLA PULIDO FRANCO
14055,2018,PRI,C. FABIOLA PULIDO FRANCO
14055,2021,PRI,ING. MARCO TREJO TELLEZ GIRON
14056,1992,PRI,ING. AUDON SANCHEZ OCHOA
14056,1995,PAN,C. JESUS MENDOZA VALENCIA
14056,1998,PAN,C. LUIS SANDOVAL GARCIA
14056,2000,PAN,C. FERNANDO FARIAS CARRANZA
14056,2004,PAN,C. ODOCIO SANDOVAL GARCIA
14056,2007,PAN,C. AUDEL OCHOA PEREZ
14056,2009,AXJ,C. RAFAEL LOPEZ NUÑEZ
14056,2012,CPJ,C. MARIA ARACELI ESPINOZA GONZALEZ
14056,2015,PRI,C. ELEAZAR MEDINA CHAVEZ
14056,2018,PRI,C. GUADALUPE SANDOVAL FARIAS
14056,2021,PRI,C. GUADALUPE SANDOVAL FARIAS
14057,1992,PRI,C. DANIEL FIGUEROA DIAZ
14057,1995,PFCRN,PROFR. JOSE DE JESUS BERROSPE DIAZ
14057,1998,PRI,LIC. VICTOR HUGO SANCHEZ LOPEZ
14057,2000,PRD,C. JUAN MARTIN ESPINOZA CARDENAS
14057,2004,PRI,C. RAFAEL CONTRERAS AGUILAR
14057,2007,COALICIÓN,C. JUAN MARTIN ESPINOZA CARDENAS
14057,2009,PAN,C. RAFAEL ALEJANDRO ALVAREZ ESPINOZA
14057,2012,APPJ,C. JUAN MARTIN ESPINOZA CARDENAS
14057,2015,PRI,C. CARLOS ANDRES LOPEZ BARBOSA
14057,2018,PVEM,C. CARLOS ANDRES LOPEZ BARBOSA
14057,2021,FXM,ING. LUIS MIGUEL SANCHEZ DEL RIO
14058,1992,PAN,ING. LEONARDO GOMEZ GONZALEZ
14058,1995,PAN,ING. LEONARDO GOMEZ GONZALEZ
14058,1998,PAN,ING. HUMBERTO RODRIGUEZ RODRIGUEZ
14058,2000,PRI,C. ALVARO LOPEZ ESPARZA
14058,2004,PVEM,C. VICENTE MADRIGAL OCHOA
14058,2007,PVEM,C. MARTIN RAFAEL PEREZ HERNANDEZ
14058,2009,PAN,C. JOSE PLACIDO DUEÑAS MEDA
14058,2012,APPJ,ING. MIGUEL CASTILLON LOPEZ
14058,2015,COAL.,C. NICOLAS BRISEÑO LOPEZ
14058,2018,MC,C. SARA EUGENIA CASTILLON OCHOA
14058,2021,MORENA,LIC. MARCO ANTONIO RUBIO LOPEZ
14059,1992,PRI,LIC. AURELIO BONIFACIO TOSCANO HERNANDEZ
14059,1995,PRI,LIC. AURELIO BONIFACIO TOSCANO HERNANDEZ
14059,1998,PRD,LIC. ISMAEL ROGELIO PULIDO MATA
14059,2000,PRI,DR. EDUARDO ANAYA RUAN
14059,2004,PRI,C. MIGUEL MEJIA CONTRERAS
14059,2007,PRI,C. EDUARDO ANAYA RUAN
14059,2009,PRD,C.P. JORGE BERNAL LARA
14059,2012,CPJ,C. EDUARDO ANAYA RUAN
14059,2015,COAL.,C. ANTONIO DE JESUS RAMIREZ RAMOS
14059,2018,PVEM,C. ANTONIO DE JESUS RAMIREZ RAMOS
14059,2021,HAGAMOS,ARQ. JORGE ENRIQUE MAGAÑA VALENCIA
14060,1992,PRI,C. MIGUEL GARCIA SANTIBAÑEZ
14060,1995,PRI,LIC. JOSE GENARO TORRES PLASCENCIA
14060,1998,PAN,LIC. RENE MARTIN AGUIRRE CORDERO
14060,2000,PAN,LIC. RUBEN PEREZ LOMELI
14060,2004,PAN,C. JESUS YAÑEZ GONZALEZ
14060,2007,PAN,C. BENITO PEREZ SANDOVAL
14060,2009,AXJ,C. JOSE ALBERTO TORRES GARCIA
14060,2012,PAN,C. RAFAEL ESTRADA JAUREGUI
14060,2015,PRI,C. JUAN RAMON LOZANO JAUREGUI
14060,2018,PAN,C. NADIA NOEMI ORTIZ PEREZ
14060,2021,PRI,C. LEONARDO GOMEZ LOMELI
14061,1992,PRI,PROFR. JOSE ANTONIO LOPEZ MACIAS
14061,1995,PRI,C. TOMAS TORRES SANCHEZ
14061,1998,PRI,ING. ABEL MADERA SIERRA
14061,2000,PRI,LIC. MARIO MEDRANO DE LA TORRE
14061,2004,PRI,C. FRANCISCO DE LA TORRE NAVA
14061,2007,PAN,C. ERNESTO DE LA TORRE MARTINEZ
14061,2009,PAN,C. RAMON BAÑUELOS BONILLA
14061,2012,CPJ,C. ALVARO MADERA LOPEZ
14061,2015,PRI,C. MISAEL CRUZ DE HARO
14061,2018,PAN,C. CESAR ROLANDO DE LA TORRE MARTINEZ
14061,2021,PAN,C. CESAR ROLANDO DE LA TORRE MARTINEZ
14062,1992,PRI,ING. SEBASTIAN ANAYA GUERRERO
14062,1995,PRI,C. JOSE RIGOBERTO TOPETE FAUSTO
14062,1998,PRI,LIC. JOSE MANUEL GONZALEZ BECERRA
14062,2000,PRI,C. HILDA MIREYA CURIEL ARIAS
14062,2004,PRI,C. JOSE MANUEL GONZALEZ BECERRA
14062,2007,PAN,C. ALFREDO TOPETE MACEDO
14062,2009,PAN,C. JOSE ALFREDO PEÑA ARIAS
14062,2012,CPJ,C. LAMBERTO GUERRA ANAYA
14062,2015,PMC,C. RAMON OCTAVIO DE LEON DE LEON
14062,2018,MC,C. MARIA MAGDALENA MORENO ANGEL
14062,2021,PRI,C. EVA MARIA RUBIO BECERRERA
14063,1992,PRI,ING. ENRIQUE GARCIA HERNANDEZ
14063,1995,PDM,C. JOSE DE JESUS GONZALEZ ACEVES
14063,1998,PRI,ING. PEDRO JAIME ZUÑIGA
14063,2000,PRI,ING. ENRIQUE GARCIA HERNANDEZ
14063,2004,PRI,C. JUAN MANUEL ALATORRE FRANCO
14063,2007,PAN,C. ABSALON GARCIA OCHOA
14063,2009,AXJ,C. JUAN CARLOS GODINEZ GODINEZ
14063,2012,CPJ,C. ENRIQUE ROBLEDO SAHAGUN
14063,2015,PMC,C. PAULO GABRIEL HERNANDEZ HERNANDEZ
14063,2018,MC,C. PAULO GABRIEL HERNANDEZ HERNANDEZ
14063,2021,MORENA,DR. JOSUE AVILA MORENO
14064,1992,PRI,L.A.E. RAFAEL MARMOLEJO AMAYA
14064,1995,PRI,C. SALVADOR VELA BRIONES
14064,1998,PRD,C. MARCO ANTONIO JASSO ROMO
14064,2000,PRD,C. BENJAMIN PLASCENCIA GOMEZ
14064,2004,PRI,ING. JUAN CESAR CONTRERAS MACIAS
14064,2007,COALICIÓN,C. RAFAEL DAVILA GONZALEZ
14064,2009,PAN,C. JOSE GIL MACIAS
14064,2012,CPJ,C. JOSE DE JESUS TOVAR GOMEZ
14064,2015,COAL.,C. DAVID GONZALEZ GONZALEZ
14064,2018,COAL.,C. MARCO ANTONIO JASSO ROMO
14064,2021,PMC,C. MARCO ANTONIO JASSO ROMO
14065,1992,PRI,C. ALFREDO CASILLAS MENDOZA
14065,1995,PRI,L.A.E. JESUS CUEVAS MORFIN
14065,1998,PRI,C. MARIO HECTOR GONZALEZ FLORES
14065,2000,CD,C. JESUS SOLORZANO CASTELLANOS
14065,2004,PRI,C. FELIPE DE JESUS MAYORAL LANDIN
14065,2007,PRI,C. MARIO HECTOR GONZALEZ FLORES
14065,2009,AXJ,C. FELIPE DE JESUS MAYORAL LANDIN
14065,2012,APPJ,C. EVERARDO CONTRERAS LOPEZ
14065,2015,PMC,C. MARIA ELIZABETH ALCARAZ VIRGEN
14065,2018,COAL.,C. JUAN ALCARAZ VIRGEN
14065,2021,PRI,C. HUMBERTO AMEZCUA BAUTISTA
14066,1992,PRI,L.A.E. MANUEL VELAZQUEZ GUTIERREZ
14066,1995,PAN,C. J. GUADALUPE NAVARRO DIAZ
14066,1998,PRI,LIC. JUAN MARTINEZ FLORES
14066,2000,PAN,C. ADALBERTO BECERRA CASTAÑANOS
14066,2004,PRI,C. CARLOS RODOLFO GARCIA BECERRA
14066,2007,COALICIÓN,C. RAMON ROMO GONZALEZ
14066,2009,PRD,C. CARLOS MALDONADO GUERRERO
14066,2012,CPJ,C. VICTOR CARRILLO MUÑOZ
14066,2015,COAL.,C. JUAN CARLOS MONTES JOHNSTON
14066,2018,COAL.,C. LUIS MIGUEL NUÑEZ LOPEZ
14066,2021,PMC,PROFR. ARTURO ISRRAEL ASCENCIO GOMEZ
14067,1992,PRI,ING. RODOLFO GONZALEZ MACIAS
14067,1995,PAN,C. LUIS FERNANDO GONZALEZ CORONA
14067,1998,PAN,C. DAVID CUEVAS GARCIA
14067,2000,PAN,L.A.E. IGNACIO GUZMAN GARCIA
14067,2004,PRI,C. GUSTAVO GONZALEZ VILLASEÑOR
14067,2007,PRI,C. FRANCISCO JAVIER BRAVO CARBAJAL
14067,2009,AXJ,LIC. SALVADOR GONZALEZ RESENDIZ
14067,2012,APPJ,C. RAMON DEMETRIO GUERRERO MARTINEZ
14067,2015,PMC,C. ARTURO DAVALOS PEÑA
14067,2018,PMC,C. RODOLFO DOMINGUEZ MONROY
14067,2021,MORENA,L.A.E. LUIS ALBERTO MICHEL RODRIGUEZ
14068,1992,PAN,C. PEDRO DIAZ MARTINEZ
14068,1995,PAN,C. FRANCISCO PELAYO GARCIA
14068,1998,PRI,LIC. SALVADOR PELAYO GARCIA
14068,2000,PRI,C. SAUL LLAMAS ROMERO
14068,2004,PAN,C. IVAN MANUEL GARCIA MICHEL
14068,2007,PRI,C. CARLOS ANTONIO PELAYO GARCIA
14068,2009,PAN,ING. MOISES DOMINGUEZ ESPARZA
14068,2012,CPJ,C. VALENTIN RODRIGUEZ PEÑA
14068,2015,PAN,C. EDGAR MANUEL MEDINA REYES
14068,2018,MC,C. MOISES BRAMBILA PELAYO
14068,2021,PRD,C. MARIA GUADALUPE SANCHEZ ZAVALZA
14069,1992,PRI,C. JOSE LUIS CONTRERAS VALENCIA
14069,1995,PRD,PROFR. LORENZO RAMOS MEJIA
14069,1998,PRD,C. JOSE GUADALUPE GONZALEZ CONTRERAS
14069,2000,PRI,C. JUAN MANUEL SANCHEZ SANCHEZ
14069,2004,PRI,C. SALVADOR MALDONADO BARAJAS
14069,2007,PRI,C. IRALDO CONTRERAS AGUILAR
14069,2009,AXJ,LIC. ALFREDO ALEJANDRO GUTIERREZ AGUILAR
14069,2012,CPJ,C. IRALDO CONTRERAS AGUILAR
14069,2015,PRI,C. EFREN CERVANTES SANDOVAL
14069,2018,COAL.,C. ROGELIO CONTRERAS GODOY
14069,2021,PAN,LIC. ROGELIO CONTRERAS GODOY
14070,1992,PRI,ING. JOSE DE JESUS MARTINEZ PONCE
14070,1995,PAN,C. CARLOS DUEÑAS LOMELI
14070,1998,PRI,LIC. JOSE DE JESUS ROMO HUERTA
14070,2000,PAN,LIC. JOSE DE JESUS GONZALEZ CUEVAS
14070,2004,PAN,DRA. BERTHA ALICIA MORENO ALVAREZ
14070,2007,PRI,C. JOEL GONZALEZ DIAZ
14070,2009,AXJ,C. GRACIELA HERNANDEZ VAZQUEZ
14070,2012,CPJ,C. JOEL GONZALEZ DIAZ
14070,2015,PRI,C. MARCOS GODINEZ MONTES
14070,2018,COAL.,C. RICARDO ZAID SANTILLAN CORTE
14070,2021,PMC,C. RICARDO ZAID SANTILLAN CORTES
14071,1992,PRI,PROFR. SERGIO CASILLAS ROJAS
14071,1995,PRI,LIC. J. CRISTOBAL CASTRO ROJAS
14071,1998,PRI,C. ELIAS CASTRO LUNA
14071,2000,PRI,C. J. JESUS CASTRO SANDOVAL
14071,2004,PRI,C. ELIAZER RODRIGUEZ CASTRO
14071,2007,PRI,C. J. EVERARDO CORTEZ RIVERA
14071,2009,PAN,DR. ISAURO SANCHEZ SANTANA
14071,2012,CPJ,C. ALFREDO CASTRO CASTRO
14071,2015,PAN,C. JOSE ESPINOSA CONTRERAS
14071,2018,PAN,C. MARIA LUZ ELENA GUZMAN CARDONA
14071,2021,PAN,C. MARIA LUZ ELENA GUZMAN CARDONA
14072,1992,PRI,C. JOSE DE JESUS HERNANDEZ ROCHA
14072,1995,PAN,C. SANTIAGO ECHEVERRIA RAMIREZ
14072,1998,PAN,LIC. JOSE ANTONIO BARBA OROZCO
14072,2000,PRI,C. J. JESUS HERNANDEZ ROCHA
14072,2004,PAN,DR. JOSE ANTONIO BARBA OROZCO
14072,2007,PAN,C. SERGIO DELGADO ECHAVARRIA
14072,2009,PAN,C. JUAN MANUEL ROJAS ESPARZA
14072,2012,CPJ,C. JOSE DE JESUS SANCHEZ GONZALEZ
14072,2015,PRI,C. OSWALDO ALATORRE SANCHEZ
14072,2018,COAL.,C. ALMA LIZZETTE DEL REFUGIO ANGEL CERRILLO
14072,2021,PVEM,C. JOSE DE JESUS SANCHEZ GONZALEZ
14073,1992,PAN,C. MIGUEL MACIAS DE RUEDA
14073,1995,PRI,C. LEOCADIO MACIAS MUÑOZ
14073,1998,PAN,C. MOISES LOZA GARCIA
14073,2000,PVEM,C. MIGUEL REYES MARTIN
14073,2004,PVEM,C. ISMAEL DE JESUS GUTIERREZ PADILLA
14073,2007,PAN,C. ALEJANDRO DE ANDA LOZANO
14073,2009,PAN,MTRO. JOSE RAUL DE ALBA PADILLA
14073,2012,CPJ,C. HERIBERTO ATILANO GONZALEZ
14073,2015,PAN,C. ALEJANDRO DE ANDA LOZANO
14073,2018,PNA,C. JESUS UBALDO MEDINA BRISEÑO
14073,2021,PAN,C. ALEJANDRO DE ANDA LOZANO
14074,1992,PAN,C. JOSE REFUGIO MUÑOZ PEREZ
14074,1995,PRI,LIC. LUIS ENRIQUE ZERMEÑO ROCHA
14074,1998,PRI,LIC. GUILLERMO MARQUEZ ESPINOZA
14074,2000,PAN,C. SAMUEL MAGAÑA MUÑOZ
14074,2004,PRI,C. JOSE ASCENCION GARCIA LOZANO
14074,2007,PAN,C. SAMUEL MAGAÑA MUÑOZ
14074,2009,PAN,LIC. LUIS ERNESTO ARELLANO GARCIA
14074,2012,CPJ,C. JOSE ASUNCION GARCIA LOZANO
14074,2015,PRI,C. JUAN JOSE DE ANDA GONZALEZ
14074,2018,MC,C. EFRAIN VILLEGAS ACEVES
14074,2021,PAN,C. MARIA ISABEL LOZA RAMIREZ
14075,1992,PRI,DR. ROBERTO MARISCAL MARQUEZ
14075,1995,PRI,ING. BALTAZAR CURIEL GARCIA
14075,1998,PRD,C. DANIEL MARTIN GONZALEZ BERNAL
14075,2000,PRD,DR. PLACIDO VILLARREAL VILLANUEVA
14075,2004,PRI,C. BALTAZAR CURIEL GARCIA
14075,2007,PRI,C. EDUARDO ALEJANDRO DIAZ PAREDES
14075,2009,PAN,LIC. RAMIRO AMEZQUITA DIAZ
14075,2012,CPJ,C. EDUARDO ALEJANDRO DIAZ PAREDES
14075,2015,PRI,C. BALTAZAR CURIEL GARSIA
14075,2018,COAL.,C. DAVID SANCHEZ DOMINGUEZ
14075,2021,PMC,LIC. MARTHA PATRICIA REYES RUIZ
14076,1992,PRI,PROFR. RAUL ARELLANO MIRAMONTES
14076,1995,PRI,PROFR. RIGOBERTO MACIAS CORTES
14076,1998,PRI,C. MANUEL MARIN BAUTISTA
14076,2000,PRI,C. HUMBERTO ESPARZA JIMENEZ
14076,2004,PAN,C. FRANCISCO HERRERA AVILA
14076,2007,PRI,C. CARLOS FRANCO VALDIVIA
14076,2009,AXJ,C. JOSE FRANCISCO AYON JIMENEZ
14076,2012,CPJ,C. JOSE MIGUEL ANGEL FERNANDEZ SOTO
14076,2015,PAN,C. ADRIAN MONTES VELAZQUEZ
14076,2018,MC,C. EVANGELINA PEREZ VILLARREAL
14076,2021,PMC,LIC. EVANGELINA PEREZ VILLARREAL
14077,1992,PRI,C. CASIMIRO ZARATE GUERRERO
14077,1995,PRD,DR. CARLOS ALBERTO ROSAS CAMACHO
14077,1998,PRI,C. MARIA GUADALUPE URZUA FLORES
14077,2000,PAN,DR. CARLOS ALBERTO ROSAS CAMACHO
14077,2004,PAN,ING. VICENTE ACEVES SANTOS
14077,2007,COALICIÓN,C. CARLOS ALBERTO ROSAS CAMACHO
14077,2009,AXJ,DR. FRANCISCO JAVIER GUERRERO NUÑEZ
14077,2012,CPJ,C. JUANA CEBALLOS GUZMAN
14077,2015,PMC,C. CARLOS ALBERTO ROSAS CAMACHO
14077,2018,COAL.,C. MOISES RODRIGUEZ CAMACHO
14077,2021,PMC,L.C.P. MOISES RODRIGUEZ CAMACHO
14078,1992,PRI,C. RAFAEL LOZANO ROBLEDO
14078,1995,PAN,C. JOSE LUIS JIMENEZ MARTIN
14078,1998,PAN,C. VICTOR MANUEL QUIROZ REYNOSO
14078,2000,PAN,C. JOSE LUIS JIMENEZ MARTIN
14078,2004,PVEM,C. AGUSTIN HURTADO GUTIERREZ
14078,2007,PAN,C. EDGAR NAPOLEON GONZALEZ ANAYA
14078,2009,AXJ,C. NORMA EDITH GUTIERREZ CORNEJO
14078,2012,CPJ,C. JOSE EDUARDO DE ALBA ANAYA
14078,2015,PAN,C. GABRIEL MARQUEZ MARTINEZ
14078,2018,COAL.,C. ALONSO DE JESUS VAZQUEZ JIMENEZ
14078,2021,PMC,DR. LUIS ALFONSO NAVARRO TRUJILLO
14079,1992,PAN,ING. JOSE RAMIREZ YAÑEZ
14079,1995,PAN,ING. J. JESUS ARANDA CISNEROS
14079,1998,PRI,C. JOSE FELIPE SANCHEZ CABALLERO
14079,2000,PAN,L.A.E. JUAN SANCHEZ GOMEZ
14079,2004,PAN,C. VICTOR DIEGO CANO
14079,2007,PAN,C. JOSE DIEGO ROSALES
14079,2009,PAN,LIC. ALFREDO NARANJO LOPEZ
14079,2012,CPJ,C. FRANCISCO DE PAUL JIMENEZ MEJIA
14079,2015,PMC,C. JAIME RIOS ARIAS
14079,2018,PRI,C. ARIANA BARAJAS GALVEZ
14079,2021,PMC,C. NESTOR EMMANUEL DE LA CRUZ MACIAS
14080,1992,PRI,ING. FERNANDO CERVANTES GOMEZ
14080,1995,PRI,C. IGNACIO GUDIÑO SALAZAR
14080,1998,PRI,C. JUAN YAÑEZ MORALES
14080,2000,PRI,C. VICENTE AGUIRRE ROSAS
14080,2004,PRI,C. MIGUEL CIBRIAN BERNAL
14080,2007,COALICIÓN,C. EFREN ALVAREZ LOPEZ
14080,2009,AXJ,C. JUAN YAÑEZ MORALES
14080,2012,CPJ,C. YECENIA PULIDO AVALOS
14080,2015,PMC,C. JESUS DAMIAN VAZQUEZ BARAJAS
14080,2018,PVEM,C. LUIS ALBERTO ARREDONDO LOPEZ
14080,2021,PMC,LIC. MARIA AURORA PONCE PEÑA
14081,1992,PAN,C. JOSE GUADALUPE CARRERA RIVAS
14081,1995,PAN,C. JOSE ALBERTO HERRERA GARCIA
14081,1998,PAN,C. JOSE GUADALUPE CARRERA RIVAS
14081,2000,PAN,ING. AGUSTIN GUZMAN AGUILAR
14081,2004,PAN,C. JOSE GUADALUPE CARRERA RIVAS
14081,2007,PAN,C. ENRIQUE MARQUEZ
14081,2009,PAN,LIC. JORGE AUSENCIO FLORES BARCENAS
14081,2012,CPJ,C. JORGE ADAN RAMIREZ MARTINEZ
14081,2015,PRI,C. JOSE HERMINIO AVALOS AVILA
14081,2018,COAL.,C. CESAR FORTINO MARQUEZ ROBLES
14081,2021,PRI,L.A.E. MINERVA ROBLES ORTEGA
14082,1992,PRI,LIC. GERARDO VILLALOBOS ARROYO
14082,1995,PAN,DR. PRIMITIVO CURIEL GARCIA
14082,1998,PRD,M.V.Z. SAMUEL RIVAS PEÑA
14082,2000,PRI,DR. JORGE GONZALEZ FIGUEROA
14082,2004,PRD,C. SAMUEL RIVAS PEÑA
14082,2007,PVEM,C. ANDRES SANCHEZ SANCHEZ
14082,2009,PRD,C. SAMUEL RIVAS PEÑA
14082,2012,CPJ,C. JORGE GONZALEZ FIGUEROA
14082,2015,PRD,C. JORGE CAMPOS AGUILAR
14082,2018,C.I.,C. OSCAR DANIEL CARRION CALVARIO
14082,2021,PMC,C. OSCAR DANIEL CARRION CALVARIO
14083,1992,PRI,C. JOSE ROSARIO ZAVALA QUEZADA
14083,1995,PRI,C. NARCISO VALDEZ PARTIDA
14083,1998,PRD,DR. JOSE DE JESUS MORALES DELGADILLO
14083,2000,PRI,C. NARCISO VALDEZ PARTIDA
14083,2004,PRI,L.T.S. MARIA ELENA NUÑEZ CASAS
14083,2007,COALICIÓN,C. CIPRIANO AGUAYO DURAN
14083,2009,PRD,C. SALVADOR JORGE RIVERA GUERRERO
14083,2012,CPJ,C. ANTONIO LOPEZ OROZCO
14083,2015,COAL.,C. AARON CESAR BUENROSTRO CONTRERAS
14083,2018,COAL.,C. ENRIQUE GABRIEL BUENROSTRO AHUED
14083,2021,PRI,C. ANTONIO PORFIRIO CASILLAS DIAZ
14084,1992,PRI,LIC. JAVIER REGINO TRUJILLO PALOMERA
14084,1995,PAN,C. JOSE MANUEL RAMIREZ JIMENEZ
14084,1998,PRI,C. DAVID SANCHEZ GUERRA
14084,2000,PRI,LIC. JORGE LUIS TERRIQUEZ HERNANDEZ
14084,2004,PRI,PROFR. ROBERTO PALOMERA PRECIADO
14084,2007,PRI,C. GILDARDO SANCHEZ GONZALEZ
14084,2009,PAN,C. SALVADOR MARTIN URIBE GIL
14084,2012,CPJ,C. HECTOR JAVIER PALOMERA URIBE
14084,2015,COAL.,C. MARIA VIOLETA BECERRA OSORIA
14084,2018,PRI,C. MARTIN EDUARDO GUZMAN PEÑA
14084,2021,MORENA,DRA. PATRICIA SANCHEZ MORO
14085,1992,PRI,DR. JULIO R. PANDURO CASILLAS
14085,1995,PAN,C. JOSE ANGEL OCEGUERA MARTINEZ
14085,1998,PRI,C. LAZARO ARIAS MARTINEZ
14085,2000,PRI,PROFR. JUAN MANUEL GUIZAR ZAMORA
14085,2004,PAN,TEC. AURELIO RUBIO MONTAÑO
14085,2007,PAN,C. JULIO CESAR RUIZ GONZALEZ
14085,2009,PAN,C. ANGEL BARBOZA MADRIZ
14085,2012,PRD,C. FRANCISCO JAVIER ALVAREZ CHAVEZ
14085,2015,COAL.,C. JOSE LUIS AMEZCUA ARIAS
14085,2018,COAL.,C. FRANCISCO JAVIER ALVAREZ CHAVEZ
14085,2021,FUTURO,C. RAUL EVERARDO GUTIERREZ CASTAÑEDA
14086,1992,PRI,C. PEDRO ZAMORA LOPEZ
14086,1995,PRI,C. JOSE LUIS ARIAS RODRIGUEZ
14086,1998,PRI,C. ARNOLDO ZAMORA JIMENEZ
14086,2000,PRI,C. RAMON GARCIA VELASCO
14086,2004,PAN,C. JOSE ANGEL DELGADO RODRIGUEZ
14086,2007,COALICIÓN,C. JOSE GUADALUPE H. LEDEZMA DELGADO
14086,2009,AXJ,LIC. JUAN MANUEL RUBIO PEREZ
14086,2012,PNA,C. MARTIN DANIEL BACILIO
14086,2015,PRD,C. ANTONIO MORALES DIAZ
14086,2018,COAL.,C. LUZ ELVIRA MANZANO OCHOA
14086,2021,PMC,C. ANTONIO ZAMORA VELAZCO
14087,1992,PRI,C. ALBERTO HERRERA CASILLAS
14087,1995,PRI,C. JOSE LARIOS SOTO
14087,1998,PAN,LIC. MANUEL SOTO LARIOS
14087,2000,PAN,PROFR. EDUARDO DELGADILLO PULIDO
14087,2004,PRI,C. ALBERTO BENJAMIN CHAVEZ POOT
14087,2007,PAN,C. MANUEL SOTO LARIOS
14087,2009,AXJ,PROFR. ROGELIO LLAMAS ROJO
14087,2012,PRD,C. MAURICIO ALBERTO CONTRERAS PEREZ
14087,2015,PRI,C. VICTOR JOSE GUADALUPE DIAZ CONTRERAS
14087,2018,MC,C. MARTIN LARIOS GARCIA
14087,2021,PMC,C. MARTIN LARIOS GARCIA
14088,1992,PRI,M.V.Z. VICTOR MANUEL RAMIREZ SOLTERO
14088,1995,PRI,C. RICARDO RAMIREZ LOPEZ
14088,1998,PRI,C. RITO GARCIA LEPE
14088,2000,PAN,PROFR. JOSE BERNARDO PRECIADO FLORES
14088,2004,PRI,ING. CUITLAHUAC IGNACIO ARIAS MERINO
14088,2007,PRI,C. ALBERTO ESPINOSA SAUZA
14088,2009,AXJ,C. JUAN LEON GIL
14088,2012,CPJ,C. FRANCISCO JAVIER BRAMBILA GONZALEZ
14088,2015,PAN,C. JUAN MANUEL MARIA CAPISTRAN
14088,2018,PRI,C. RICARDO RAMIREZ RUELAS
14088,2021,PRI,LIC. ARTURO ELIUD SALDAÑA VAZQUEZ
14089,1992,PRI,C. ALBERTO GOMEZ VERA
14089,1995,PAN,LIC. OCTAVIO FRANCISCO NAVARRO PRIETO
14089,1998,PAN,ING. HECTOR MANUEL LOPEZ RUELAS
14089,2000,PAN,LIC. HECTOR CORTES CORTES
14089,2004,PRI,C. LUIS ENRIQUE CALVARIO CABRERA
14089,2007,PRI,C. ALFREDO NODAL PADILLA
14089,2009,PAN,LIC. HECTOR CORTES CORTES
14089,2012,APPJ,C. SERGIO VELAZQUEZ ENRIQUEZ
14089,2015,PMC,C. HECTOR CORTES CORTES
14089,2018,COAL.,C. SERGIO VELAZQUEZ ENRIQUEZ
14089,2021,PES,PROFR. HECTOR CORTES CORTES
14090,1992,PRI,LIC. RUBEN PONCE SANCHEZ
14090,1995,PRI,DR. SALVADOR MARIN BUENROSTRO
14090,1998,PRI,LIC. BENJAMIN GOMEZ SOLTERO
14090,2000,PVEM,C. MA. DEL REFUGIO BRAVO GARCIA
14090,2004,PRI,C. VICENTE CARDENAS REGLA
14090,2007,PAN,C. ALEJANDRO ESTRELLA CUMPLIDO
14090,2009,PAN,C. JUAN CARLOS NUÑO GARCIA
14090,2012,PAN,C. LUZ MARIA BARRAGAN ROSAS
14090,2015,PAN,C. RICARDO HERNANDEZ GARCIA
14090,2018,COAL.,C. YOLANDA MEZA ZEPEDA
14090,2021,PRI,C. JOSE MANUEL CARDENAS CASTILLO
14091,1992,PRI,C. RAMON VIDAURRI JAUREGUI
14091,1995,PAN,C. RAFAEL PEREZ VILLEGAS
14091,1998,PRI,C.P. ROBERTO LOPEZ DELGADO
14091,2000,PRI,L.A.E. JUAN MANUEL LOPEZ DELGADO
14091,2004,PRI,C. EMMA MUÑOZ COVARRUBIAS
14091,2007,PRI,C. ANTONIO DIAZ GONZALEZ
14091,2009,PAN,C. JOSE LUIS MARTINEZ VELAZQUEZ
14091,2012,CPJ,C. JUAN MANUEL GONZALEZ JIMENEZ
14091,2015,PAN,C. ABEL HERNANDEZ MARQUEZ
14091,2018,COAL.,C. ABEL HERNANDEZ MARQUEZ
14091,2021,MORENA,C. JUAN MANUEL VALLEJO PEDROZA
14092,1992,PRI,C. EDUARDO SAHAGUN MIRANDA
14092,1995,PRI,LIC. MANUEL GODINEZ SAHAGUN
14092,1998,PRI,LIC. JACOBO GONZALEZ LOMELI
14092,2000,PAN,C. GUILLERMO SAHAGUN MIRANDA
14092,2004,PRI,C. JAVIER ESPARZA VILLARRUEL
14092,2007,PRI,C. CARLOS ALBERTO ARIAS VILLARRUEL
14092,2009,PAN,C.P. JOSE GONZALEZ GARCIA
14092,2012,CPJ,C. CARLOS ADRIAN LOMELI BECERRA
14092,2015,PAN,C. CARLOS EDUARDO HERNANDEZ FLORES
14092,2018,COAL.,C. CARLOS EDUARDO HERNANDEZ FLORES
14092,2021,PVEM,C. RICARDO SAHAGUN QUIÑONEZ
14093,1992,PAN,C.P. RIGOBERTO GONZALEZ MARTIN
14093,1995,PAN,C.P. RIGOBERTO GONZALEZ MARTIN
14093,1998,PAN,LIC. RAMON GONZALEZ GONZALEZ
14093,2000,PAN,ING. ENRIQUE NAVARRO DE LA MORA
14093,2004,PAN,LIC. LEONARDO GARCIA CAMARENA
14093,2007,PAN,C. MIGUEL FRANCO BARBA
14093,2009,AXJ,C. CECILIA GONZALEZ GOMEZ
14093,2012,PAN,C. JORGE EDUARDO GONZALEZ ARANA
14093,2015,PMC,C. HECTOR HUGO BRAVO HERNANDEZ
14093,2018,MC,C. MARIA ELENA DE ANDA GUTIERREZ
14093,2021,PAN,LIC. MIGUEL ANGEL ESQUIVIAS ESQUIVIAS
14094,1992,PRI,LIC. EDUARDO ORENDAIN GIOVANNINI
14094,1995,PAN,C. J. FELIX GARCIA RIVERA
14094,1998,PAN,LIC. GUSTAVO MACIAS ZAMBRANO
14094,2000,PAN,LIC. JOSE GUADALUPE NUÑEZ RODRIGUEZ
14094,2004,PRI,C. JOSE MIGUEL MARIN SANCHEZ
14094,2007,PAN,C. GUILLERMO CORDERO GARCIA
14094,2009,PAN,C. GERMAN GARCIA RIVERA
14094,2012,PAN,C. GILBERTO ARELLANO SANCHEZ
14094,2015,COAL.,C. FELIPE DE JESUS JIMENEZ BERNAL
14094,2018,COAL.,C. JOSE ALFONSO MAGALLANES RUBIO
14094,2021,PAN,TEC. JOSE ALFONSO MAGALLANES RUBIO
14095,1992,PARM,C. ANICETO SEDANO SANCHEZ
14095,1995,PRI,PROFR. SALVADOR OROZCO SANTIAGO
14095,1998,PRI,LIC. ENRIQUE MEZA ROSALES
14095,2000,PRI,C. ANASTACIO VALDEZ MORAN
14095,2004,PRD,C. OSCAR RIVERA GONZALEZ
14095,2007,PRI,C. ENRIQUE MEZA ROSALES
14095,2009,PRD,C.P. OSCAR RIVERA GONZALEZ
14095,2012,PRD,C. JOSE ASCENCION MURGUIA SANTIAGO
14095,2015,PAN,C. ARMANDO ANDRADE GUTIERREZ
14095,2018,COAL.,C. JOSE ALEJANDRO ARREOLA SOTO
14095,2021,PMC,M.C. JOSE ASCENCION MURGUIA SANTIAGO
14096,1992,PRI,C. SALVADOR CARDENAS GARCIA
14096,1995,PRI,DR. AUSTREBERTO ANAYA ANGUIANO
14096,1998,PRI,C. ALFREDO FLORES CASTAÑEDA
14096,2000,PAN,PROFR. ERNESTO OCHOA BUENROSTRO
14096,2004,PRI,C. ALFREDO FLORES CASTAÑEDA
14096,2007,PRI,C. RAMON MARTINEZ MORFIN
14096,2009,PAN,PROFR. SALVADOR AVALOS CARDENAS
14096,2012,CPJ,C. RAMON MARTINEZ MORFIN
14096,2015,PRI,C. JOSE SANTIAGO CORONADO VALENCIA
14096,2018,PRI,C. JOSE SANTIAGO CORONADO VALENCIA
14096,2021,PMC,C. MARTIN SILVA RAMIREZ
14097,1992,PRI,LIC. ANTONIO SANCHEZ RAMIREZ
14097,1995,PAN,C. MANUEL GUZMAN DE LA TORRE
14097,1998,PRI,C. ERNESTO DIAZ MARQUEZ
14097,2000,PRI,DR. GUILLERMO SANCHEZ MAGAÑA
14097,2004,PAN,C. ANDRES ZERMEÑO BARBA
14097,2007,PAN,C. JOSE ANTONIO TATENGO UREÑA
14097,2009,CLT,LIC. ALBERTO URIBE CAMACHO
14097,2012,APPJ,C. ISMAEL DEL TORO CASTRO
14097,2015,PMC,C. ALBERTO URIBE CAMACHO
14097,2018,MC,C. SALVADOR ZAMORA ZAMORA
14097,2021,PMC,C. SALVADOR ZAMORA ZAMORA
14098,1992,PRI,ING. J. EDUARDO RIVERON GAMEZ
14098,1995,PAN,C. MARCOS ROSAS ROMERO
14098,1998,PAN,C. JOSE MARIA ROBLES DIAZ
14098,2000,PAN,LIC. JOSE ANTONIO ALVAREZ HERNANDEZ
14098,2004,PRI,C. MIGUEL CASTRO REYNOSO
14098,2007,PAN,C. JOSE HERNAN CORTES BERUMEN
14098,2009,AXJ,LIC. MARCO ANTONIO GONZALEZ FIERRO
14098,2012,CPJ,C. ALFREDO BARBA MARISCAL
14098,2015,PMC,C. MARIA ELENA LIMON GARCIA
14098,2018,COAL.,C. MARIA ELENA LIMON GARCIA
14098,2021,PMC,SCLGA MIRNA CITLALLI AMAYA DE LUNA
14099,1992,PRI,C. ANTONIO SAHAGUN VIRGEN
14099,1995,PRI,LIC. JAVIER DELGADILLO MANCILLAS
14099,1998,PRD,C. JOSE ZARATE CAMARILLO
14099,2000,PRI,C. OSCAR ESTRELLA BONILLA
14099,2004,PRD,C. NELIDA RODRIGUEZ GUTIERREZ
14099,2007,PRI,C. SOLEDAD MELENDEZ GONZALEZ
14099,2009,AXJ,M.V.Z. JUVENTINO SAHAGUN VIRGEN
14099,2012,PRD,C. SAUL GALINDO PLAZOLA
14099,2015,COAL.,C. JORGE LUIS TELLO GARCIA
14099,2018,COAL.,C. JORGE LUIS TELLO GARCIA
14099,2021,PMC,C. DANIEL RUIZ BENAVIDES
14100,1992,PRI,LIC. J. TIMOTEO CAMPECHANO SILVA
14100,1995,PAN,DR. FELIPE JARERO ESCOBEDO
14100,1998,PRI,LIC. JORGE ARANA ARANA
14100,2000,PRI,DR. VICENTE VARGAS LOPEZ
14100,2004,PRI,C. PALEMON GARCIA REAL
14100,2007,PAN,C. EMANUEL AGUSTIN ORDOÑEZ HERNANDEZ
14100,2009,AXJ,C. JUAN ANTONIO MATEOS NUÑO
14100,2012,CPJ,C. JORGE ARANA ARANA
14100,2015,PRI,C. SERGIO ARMANDO CHAVEZ DAVALOS
14100,2018,COAL.,C. JUAN ANTONIO GONZALEZ MORA
14100,2021,MORENA,C. SERGIO ARMANDO CHAVEZ DAVALOS
14101,1992,PRI,C. PABLO ZAMORA PINEDA
14101,1995,PRI,C. JUAN MICHEL PEÑA
14101,1998,PAN,DR. MIGUEL ANGEL GARCIA SANTANA
14101,2000,PAN,C. JUSTINO MEJIA ORTEGA
14101,2004,PRI,C. ARMANDO CORONA RADILLO
14101,2007,PAN,C. RAFAEL LEAL QUILES
14101,2009,PAN,M.V.Z. ROBERTO GARCIA SANTANA
14101,2012,PAN,C. ALFONSO ATILA VIZCAINO QUILES
14101,2015,COAL.,C. LIBRADO VIZCAINO ALVAREZ
14101,2018,PRI,C. JUAN ESTEBAN MICHEL TERRIQUEZ
14101,2021,PRI,C. ARTURO URIBE PEREZ
14102,1992,PRI,C. HECTOR MANUEL ANAYA SILVA
14102,1995,PAN,PROFR. GUSTAVO MAGAÑA NEGRETE
14102,1998,PAN,LIC. IGNACIO MACIAS ZAMORA
14102,2000,PRI,C. SEBASTIAN GARCIA CARDENAS
14102,2004,PRI,C. SERGIO ANTONIO RETOLAZA MACIAS
14102,2007,PAN,C. RAUL HEREDIA MAGAÑA
14102,2009,AXJ,ING. SERGIO ANTONIO RETOLAZA MACIAS
14102,2012,PAN,C. JOSE MARTIN HERNANDEZ ALVAREZ
14102,2015,PRI,C. MARIO HARVEY CHAVEZ BOJORQUEZ
14102,2018,MC,C. JOSE MARTIN HERNANDEZ ALVAREZ
14102,2021,PMC,C. JOSE MARTIN HERNANDEZ ALVAREZ
14103,1992,PRI,C. MIGUEL ALONSO MONTAÑEZ VALDES
14103,1995,PAN,C. ALBERTO JAVIER GONZALEZ JARA
14103,1998,PAN,C. LEOBARDO ESPINOZA GONZALEZ
14103,2000,PRI,C. LUIS MANUEL ALCALA DELGADO
14103,2004,PRI,C. GILDARDO HERIBERTO AVILA MARQUEZ
14103,2007,PAN,C. SALVADOR LUNA JARA
14103,2009,PAN,LIC. LUZ ELENA CARDENAS SALAZAR
14103,2012,CPJ,C. MIGUEL ANGEL SANCHEZ SANCHEZ
14103,2015,PRI,C. GUILLERMO EDUARDO PEREZ GODINA
14103,2018,PAN,C. HUMBERTO ALONSO GOMEZ MEDINA
14103,2021,PMC,C. LUZ ELENA CARDENAS SALAZAR
14104,1992,PRI,C. AGUSTIN LOMELI ZUÑIGA
14104,1995,PRI,C.P. AGUSTIN GOMEZ PEDROZA
14104,1998,PRI,LIC. GONZALO PEDROZA CARRILLO
14104,2000,PAN,ARQ. JAIME RIGOBERTO GOMEZ VILLEGAS
14104,2004,PRI,C. AGUSTIN LOMELI ZUÑIGA
14104,2007,PAN,C. JOSE DAVID MACIAS TRUJILLO
14104,2009,AXJ,C.P. MARIA DE JESUS SALAZAR QUEZADA
14104,2012,CPJ,C. FRANCISCO JAVIER RODRIGUEZ LOMELI
14104,2015,PRI,C. JUAN GUADALUPE ACEVES DELGADO
14104,2018,COAL.,C. SERGIO QUEZADA MENDOZA
14104,2021,PMC,C. JUAN CARLOS VELAZQUEZ IÑIGUEZ
14105,1992,PRI,C. JOSE ILDEFONSO CORONA PELAYO
14105,1995,PRI,C. ANTONIO VARGAS FLORES
14105,1998,PRI,C. HECTOR SAMUEL NUÑEZ CORONA
14105,2000,PRI,C. ENRIQUE GUERRERO SANTA ANA
14105,2004,PRD,C. JAIME ALMARAZ GARIBAY
14105,2007,PAN,C. RAMON REYNAGA ARAIZA
14105,2009,AXJ,C. SERGIO RENE ARAIZA GUTIERREZ
14105,2012,CPJ,ING. JUAN FRANCISCO ZAMORA ARAIZA
14105,2015,PRI,C. JOSE GUADALUPE FLETES ARAIZA
14105,2018,PRI,C. JOSE GUADALUPE FLETES ARAIZA
14105,2021,PAN,C. RAMON REYNAGA ARAIZA
14106,1992,PARM,C. ANTONIO FIGUEROA MENDOZA
14106,1995,PRI,PROFR. EUGENIO CUEVAS HERNANDEZ
14106,1998,PT,C. ANTONIO FONSECA MENDOZA
14106,2000,PRI,C. REYES MANCILLA ACEVES
14106,2004,PRI,PROFR. ARTURO ACEVES GOMEZ
14106,2007,PAN,C. GONZALO NAVARRO HERNANDEZ
