uniqueid,year,incumbent_party_inafed,incumbent_candidate_inafed
14106,2009,PAN,ING. MARCO ANTONIO BARRERA TACHIQUIN
14106,2012,CPJ,C. REYES MANCILLA ACEVES
14106,2015,PMC,C. CUAUHTEMOC SOSA CARDENAS
14106,2018,PRI,C. REYES MANCILLA ACEVES
14106,2021,PVEM,C. LUIS ANTONIO ACEVES GARCIA
14107,1992,PRI,LIC. JOSE GUADALUPE ZUNO CUELLAR
14107,1995,PT,C. JORGE FRANCISCO PEREZ LARES
14107,1998,PRI,C. JOSE ALBERTO VAZQUEZ ELIZONDO
14107,2000,PVEM,TEC. CARLOS BALTAZAR SIERRA
14107,2004,PAN,ING. GERARDO MEDINA CHAVEZ
14107,2007,PVEM,C. FELIPE DE JESUS RUA VAZQUEZ
14107,2009,PAN,ING. DOMINGO MARTINEZ CORTES
14107,2012,CPJ,C. FELIPE DE JESUS RUA VAZQUEZ
14107,2015,PNA,C. EDWIN ROMERO CORTES
14107,2018,PNA,C. EDWIN ROMERO CORTES
14107,2021,MORENA,L.A.E. CLAUDIA GIL MONTES
14108,1992,PAN,C. FRANCISCO JAVIER ARRIETA GARCIA
14108,1995,PRI,C. FELIPE GONZALEZ MUÑOZ
14108,1998,PRI,LIC. DAVID MENDOZA PEREZ
14108,2000,PRI,C. FELIPE GONZALEZ MUÑOS
14108,2004,PRI,C. DAVID MENDOZA PEREZ
14108,2007,PAN,C. JOSE HERON GUTIERREZ REYNOSO
14108,2009,PAN,C. JESUS HURTADO GONZALEZ
14108,2012,PAN,LIC. JOSE DE JESUS HURTADO TORRES
14108,2015,PAN,C. JULIO CESAR HURTADO LUNA
14108,2018,COAL.,C. JULIO CESAR HURTADO LUNA
14108,2021,PAN,LIC. PAULA GUTIERREZ MAGAÑA
14109,1992,PRI,DR. HUGO SALVADOR CASTELLANOS PEREZ
14109,1995,PAN,DR. MIGUEL BONAL GONZALEZ
14109,1998,PAN,ARQ. RAFAEL RAMIREZ ESTRELLA
14109,2000,PAN,LIC. SALVADOR NUÑEZ SANDOVAL
14109,2004,PAN,C. JOEL LLAMAS URIBE
14109,2007,PRI,C. CESAR EDUARDO HEREFORD LARIOS
14109,2009,PAN,C. HECTOR ALEJANDRO RAMIREZ MEZA
14109,2012,CPJ,C. IGNACIO RAMOS LOZANO
14109,2015,PRI,C. ERNESTO ZERMEÑO VALERA
14109,2018,COAL.,C. GALA DEL CARMEN LEPE GALVAN
14109,2021,PMC,C. GALA DEL CARMEN LEPE GALVAN
14110,1992,PRI,C. MANUEL DE LA TORRE GUTIERREZ
14110,1995,PRI,C. ALBERTO CASILLAS DIAZ
14110,1998,PAN,C. RODRIGO BARBA VILLEGAS
14110,2000,PAN,L.F.I. JUAN FRANCISCO AGUINAGA ESQUEDA
14110,2004,PAN,C. RODRIGO BARBA VILLEGAS
14110,2007,PAN,C. ALVARO IBARRA PADILLA
14110,2009,PAN,C. GABRIEL CORONADO CASILLAS
14110,2012,PAN,C. ALVARO IBARRA PADILLA
14110,2015,PRI,C. BERNARDO GONZALEZ GUTIERREZ
14110,2018,PAN,C. MARIA DEL REFUGIO BARBA GUTIERREZ
14110,2021,PMC,LIC. RAUL RENTERIA TORRES
14111,1992,PRI,DR. PEDRO PEREZ PONCE
14111,1995,PRI,DR. SALVADOR CONTRERAS CONTRERAS
14111,1998,PRI,DR. PEDRO PEREZ PONCE
14111,2000,PRI,C. LUIS ENRIQUE PULIDO SILVA
14111,2004,PAN,M.V.Z. EDUARDO RODRIGUEZ CORONA
14111,2007,PAN,C. JOSE ZEPEDA CONTRERAS
14111,2009,AXJ,ING. JOSE BARRERA MERCADO
14111,2012,PAN,C. JOSE MANUEL CHAVEZ RODRIGUEZ
14111,2015,PAN,C. CESAR DARIO MORENO NAVA
14111,2018,PAN,C. JOSE MANUEL CHAVEZ RODRIGUEZ
14111,2021,PAN,C. JOSE MANUEL CHAVEZ RODRIGUEZ
14112,1992,PRI,C. LUIS REYES RODRIGUEZ
14112,1995,PRI,LIC. JUAN CARLOS RODRIGUEZ GOMEZ
14112,1998,PAN,C. JORGE ARTURO SEDANO VARGAS
14112,2000,PRI,LIC. VICENTE EDUARDO RODRIGUEZ HERNANDEZ
14112,2004,PAN,LIC. JAVIER RAMOS FLORES
14112,2007,PRI,C. JUAN CARLOS RODRIGUEZ GOMEZ
14112,2009,PRD,C. J. ISABEL RAMOS BEATRIZ
14112,2012,CPJ,C. JUAN JOSE GUTIERREZ CONTRERAS
14112,2015,PRI,C. CESAR AUGUSTO RODRIGUEZ GOMEZ
14112,2018,COAL.,C. BONIFACIO VILLALVAZO LARIOS
14112,2021,PMC,LIC. DAVID RAFAEL VALENCIA GARCIA
14113,1992,PRI,PROFR. SILVANO BARAJAS PEREZ
14113,1995,PAN,LIC. RAFAEL RAMIREZ SANCHEZ
14113,1998,PAN,C. HUGO HERNANDEZ VILLALOBOS
14113,2000,PRI,C. RICARDO JIMENEZ CRUZ
14113,2004,PVEM,C. ADALBERTO VELASCO ANTILLON
14113,2007,PRI,C. MIGUEL REYES GONZALEZ
14113,2009,CONVER.,C. JOSE DE JESUS ORTIZ URIBE
14113,2012,CPJ,C. JOSE DE JESUS URIBE LOPEZ
14113,2015,PRI,C. RODOLFO RUBALCAVA MUÑOZ
14113,2017,PRI,ING. FRANCISCO MENDOZA MONCAYO
14113,2018,C.I.,C. LUIS RENE RUELAS ORTEGA
14113,2021,PES,ING. ARMANDO SENCION GUZMAN
14114,1992,PRI,C. AGUSTIN PINEDO VILLAGRANA
14114,1995,PRI,C. ADALBERTO MURO JARA
14114,1998,PAN,C. SALVADOR ROBLES CANTERO
14114,2000,PRI,LIC. ENRIQUE BAÑUELOS SOLIS
14114,2004,PAN,C. MANUEL JARA RODRIGUEZ
14114,2007,PRI,C. MARIO GUTIERREZ JARA
14114,2009,PAN,PROFR. REGINALDO RODRIGUEZ MEDINA
14114,2012,CPJ,C. RODOLFO RIVAS VALDES
14114,2015,PAN,C. ALDO GAMBOA GUTIERREZ
14114,2018,PAN,C. ALDO GAMBOA GUTIERREZ
14114,2021,PRI,ING. JOSE ALFREDO SOLIS SARRELANGUE
14115,1992,PRI,C. VICTOR MANUEL CRUZ ESPARZA
14115,1995,PRI,C. VICTOR MANUEL CRUZ ESPARZA
14115,1998,PRI,LIC. ARMANDO GONZALEZ MATA
14115,2000,PAN,M.V.Z. GERONIMO HERNANDEZ FIGUEROA
14115,2004,PAN,C. PABLO RODRIGUEZ AVELAR
14115,2007,PAN,C. DESIDERIO TINAJERO ROBLES
14115,2009,AXJ,C. MIGUEL ARNULFO DIAZ DE LEON LUEVANO
14115,2012,PNA,C. PABLO RODRIGUEZ AVELAR
14115,2015,PRI,C. EFRAIN LOPEZ SOTO
14115,2018,PNA,C. PABLO RODRIGUEZ AVELAR
14115,2021,FXM,L.C.P. JAIME CRUZ VILLALPANDO
14116,1992,PRI,DR. JOSE SANTOS GONZALEZ VALDIVIA
14116,1995,PRI,C. ALFREDO CARVAJAL JAUREGUI
14116,1998,PRI,DR. ROSALIO ALVAREZ IBARRA
14116,2000,PRI,C. SAMUEL CARBAJAL JAUREGUI
14116,2004,PAN,C. ROSENDO MARTINEZ PADILLA
14116,2007,PAN,C. JOSE DE JESUS SAINZ MUÑOZ
14116,2009,AXJ,LIC. CARLOS GONZALEZ PADILLA
14116,2012,CPJ,C. JUAN GABRIEL RAMIREZ BECERRA
14116,2015,PRI,C. JAIME GUSTAVO CASILLAS VAZQUEZ
14116,2018,COAL.,C. REYNALDO GONZALEZ GOMEZ
14116,2021,PVEM,DR. MIGUEL OROPEZA RUVALCABA
14117,1992,PRI,C.P. GREGORIO MANUEL GONZALEZ LIMON
14117,1995,PAN,TEC. JUAN ALFREDO RANGEL LOPEZ
14117,1998,PAN,PROFR. FAUSTO PLASCENCIA PLASCENCIA
14117,2000,PAN,C.P. SERGIO CASTAÑEDA GUTIERREZ
14117,2004,PRI,C. J. GUADALUPE DURAN JAUREGUI
14117,2007,PAN,C. ELIAS OCTAVIO IÑIGUEZ MEJIA
14117,2009,PAN,LIC. ANASTACIO MERCADO MARTINEZ
14117,2012,PAN,C. JOSE LUIS IÑIGUEZ GAMEZ
14117,2015,COAL.,C. ALEJANDRO MACIAS VELASCO
14117,2018,PRI,C. ALEJANDRO MACIAS VELASCO
14117,2021,PMC,C. DANNIELA JULEMMY VAZQUEZ GONZALEZ
14118,1992,PRI,C. FERNANDO CONTRERAS DIAZ
14118,1995,PRD,C.P. ALFREDO ESCOBAR RUIZ
14118,1998,PRI,DR. JOSE DE JESUS GOMEZ ORTIZ
14118,2000,PRI,LIC. RICARDO GOMEZ CORTES
14118,2004,PRI,C. JOSE GUTIERREZ ANGUIANO
14118,2007,PRI,C. JAVIER JIMENEZ ALVAREZ
14118,2009,PAN,LIC. SIMON FERNANDO LLAMAS BAÑUELOS
14118,2012,CPJ,C. JAVIER JIMENEZ ALVAREZ
14118,2015,PMC,C. LUIS FERNANDO SOLORZANO MADRIGAL
14118,2018,PRI,C. JAVIER JIMENEZ ALVAREZ
14118,2021,MORENA,C. HILDA CACHUX ANDRADE
14119,1992,PRI,LIC. JORGE HUMBERTO CHAVIRA MARTINEZ
14119,1995,PAN,DR. JOSE MARIA HERNANDEZ QUINTERO
14119,1998,PAN,C. JOSE C. RAMIREZ ACUÑA
14119,2000,PAN,DR. MACEDONIO TAMEZ GUAJARDO
14119,2004,PRI,C. ARTURO ZAMORA JIMENEZ
14119,2007,PAN,C. JUAN SANCHEZ ALDANA RAMIREZ
14119,2009,AXJ,C. HECTOR VIELMA ORDOÑEZ
14119,2012,CPJ,C. HECTOR ROBLES PEIRO
14119,2015,PMC,C. JESUS PABLO LEMUS NAVARRO
14119,2018,MC,C. JESUS PABLO LEMUS NAVARRO
14119,2021,PMC,C. JUAN JOSE FRANGIE SAADE
14120,1992,PRI,C.P. ROBERTO FLORES RAMON
14120,1995,PAN,DR. JORGE GALVAN MONTAÑO
14120,1998,PRI,C. JOSE AGUSTIN SAAVEDRA IGLESIAS
14120,2000,PRI,LIC. FERNANDO CEBALLOS SANCHEZ
14120,2004,PRD,ING. RAUL SANCHEZ SANCHEZ
14120,2007,PAN,C. JESUS ROBERTO CAMPOS FERNANDEZ
14120,2009,PAN,DR. FEDERICO SANCHEZ PEREZ
14120,2012,PRI,L.A.E. RAMIRO FARIAS MARTINEZ
14120,2015,COAL.,C. RENE SANTIAGO MACIAS
14120,2018,PAN,C. FRANCISCO GERARDO SEDANO VIZCAINO
14120,2021,PAN,L.E. FRANCISCO GERARDO SEDANO VIZCAINO
14121,1992,PRI,PROFR. SERGIO BEJARANO DAVALOS
14121,1995,PRI,PROFR. ADOLFO VELAZCO DE LA CRUZ
14121,1998,PRI,C. ALFONSO ARIAS VELASCO
14121,2000,PRI,PROFR. ROGELIO GONZALEZ ALVAREZ
14121,2004,PAN,C. ROGELIO MAGAÑA NAVA
14121,2007,PRI,C. ALFONSO ARIAS VELASCO
14121,2009,PAN,TEC. MARIO GALVEZ BARRETO
14121,2012,CPJ,C. JOSE MARIA VELASCO DE LA CRUZ
14121,2015,PRI,C. ALFONSO ARIAS VELASCO
14121,2018,COAL.,C. MA GUADALUPE DIAZ BLANCO
14121,2021,PRI,C. JOSE CRUZ ARIAS REYES
14122,1992,PRI,C. ROSARIO GONZALEZ GUERRERO
14122,1995,PRI,C. SILVERIO ANAYA VALDOVINOS
14122,1998,PRI,C. J. MERCED GARCIA GAMA
14122,2000,PRI,C. JUAN FLORES RAMIREZ
14122,2004,PAN,C. GUMERCINDO CASTELLANOS FLORES
14122,2007,PRI,C. DANIEL NAPOLES HERRERA
14122,2009,PAN,LIC. CARLOS OMAR GODINEZ NAPOLES
14122,2012,CPJ,C. J. JESUS CUEVAS GARCIA
14122,2015,PRD,C. CELSO FLORES HERNANDEZ
14122,2018,PVEM,C. SAUL PADILLA GUTIERREZ
14122,2021,PMC,C. SAUL PADILLA GUTIERREZ
14123,1992,PAN,DR. SIXTO APOLO CERVANTES ALVAREZ
14123,1995,PAN,C. RAUL CANO FLORES
14123,1998,PAN,DR. MARTIN GONZALEZ JIMENEZ
14123,2000,PAN,C. JOSE LUIS CARDONA DOMINGUEZ
14123,2004,PRI,DR. ROBERTO MARIN NUÑO
14123,2007,PAN,C. HECTOR ALVAREZ CONTRERAS
14123,2009,PAN,C. JUAN JOSE JIMENEZ PARRA
14123,2012,CPJ,C. FRANCISCO JAVIER PULIDO ALVAREZ
14123,2015,PMC,C. HECTOR ALVAREZ CONTRERAS
14123,2018,MC,C. HECTOR ALVAREZ CONTRERAS
14123,2021,MORENA,C. GONZALO ALVAREZ BARRAGAN
14124,2004,PAN,C. BENJAMIN OROZCO VAZQUEZ
14124,2007,PAN,C. BENJAMIN OROZCO VASQUEZ
14124,2009,PAN,C. ARTURO OROZCO AGUILAR
14124,2012,CPJ,C. ALBERTO OROZCO OROZCO
14124,2015,PRI,C. JOSE CLEOFAS OROZCO OROZCO
14124,2018,PRI,C. JOSE CLEOFAS OROZCO OROZCO
14124,2021,PRI,L.E.P. NOE PLASCENCIA GONZALEZ
