uniqueid,year,incumbent_party_inafed,incumbent_candidate_inafed
12029,2018,COAL.,C. ANTONIO GASPAR BELTRAN
12029,2021,MORENA,C. NORMA OTILIA HERNANDEZ MARTINEZ
12030,1919,NA,C. LEOPOLDO MEJIA
12030,1955,NA,C. ARCADIO MEJIA
12030,1958,NA,C. MARTIN REACHI MORALES
12030,1961,NA,C. ROMAN MEJIA
12030,1963,NA,C. ABRAHAM SOLANO
12030,1966,NA,C. FELIPE M. GATICA
12030,1969,NA,C. FERNANDO CAÑEDO MESINO
12030,1970,NA,C. AQUILINO SANTOS CALIXTO
12030,1971,NA,C. AUSTROBERTO GALLARDO MEJIA
12030,1974,NA,C. FLORENCIO FELIPE SOLANO
12030,1977,NA,C. AQUILINO SANTOS CALIXTO
12030,1980,NA,C. HERIBERTO CARRANZA GATICA
12030,1982,NA,C. ANTONIO GATICA GONZALEZ
12030,1983,NA,C. MARIANO CALLEJA SORIANO
12030,1986,NA,C. ARQUIMIDES SÁNCHEZ FLORES
12030,1989,NA,C. PEDRO VARGAS NAVA
12030,1993,PRI,C. RODOLFO PIZA MOLINA
12030,1996,PRD,C. VISMAR MOLINA GUTIERREZ
12030,1999,PRI,C. ALVIS GALLARDO CARMONA
12030,2002,COALICIÓN,LIC. TEODORO LUVIO BERNAL
12030,2005,PRD,LIC. MARGARITO GENCHI CASIANO
12030,2009,PRI,C. FULGENCIO GARIBO ONOFRE
12030,2012,PRD,C. OCIEL HUGAR GARCIA TRUJILLO
12030,2015,PRD,C. EMISEL LIOSOL MOLINA GONZALEZ
12030,2018,COAL.,C. WILBERTH SAIT GARCIA TRUJILLO
12030,2021,PRD,C. RODRIGO PAVON GALLARDO
12031,1969,NA,C. LEONARDO FABIÁN GALINDO
12031,1972,NA,C. J. ISABEL VIRTO MARTÍNEZ
12031,1975,NA,C. ADALBERTO REZA SOTELO
12031,1978,NA,C. EULOGÍ MORALES TRINIDAD
12031,1984,NA,C. TEÓDULO BENITEZ MARTÍNEZ
12031,1987,NA,C. PEDRO FLORES CASTRO
12031,1993,PRI,C. FRUCTUOSO MARTINEZ BENITEZ
12031,1996,PRI,C. PLACIDO TOVAR MORALES
12031,1999,PRI,C. JUAN MARTINEZ FELIX
12031,2002,PRD,PROFR. CESAR ORTIZ TORRES
12031,2005,PRI,C. SILVANO VALENTIN ROMAN
12031,2006,NA,C. SILVANO VALENTIN ROMÁN
12031,2009,PRD,DR. ROGER ARELLANO SOTELO
12031,2012,PRD,C. ELEUTERIO ARANDA SALGADO
12031,2015,PMC,C. ROSA ELVIRA ARANDA SALGADO
12031,2018,MC,C. ISAAC CELIS RIOS
12031,2021,PMC,C. ZESAR ORTIZ TORRES
12032,1972,NA,C. BENJAMÍN VEGA ARANDA
12032,1975,NA,C. ALFONSO CASTILLO GILES
12032,1978,NA,C. SERAFÍN CASTILLO ALARCÓN
12032,1981,NA,C. ABRAHAM SOLLANO VALDÉS
12032,1984,NA,C. JOSÉ OLÁIS ALVARADO
12032,1987,NA,C. GUMERSINDO RODRÍGUEZ ALTAMIRANO
12032,1988,NA,C. CAMERINO REYNA TORRES
12032,1990,NA,C. PEDRO MORENO CHAPA
12032,1993,PRI,C. GERMAN TELLES GILES
12032,1996,PRI,PROFRA. MARIA GUADALUPE CASTILLO DIAZ
12032,1999,PRI,C. JOSE CONCEPCION HERNANDEZ SOLANO
12032,2002,COALICIÓN,PROFR. SEVERO OYORZABAL DIAZ
12032,2005,PAN,C. EFRAIN FIGUEROA DURAN
12032,2009,PRI,PROFR. ALFONZO GARCIA CATALAN .
12032,2012,PRD,C. MARIO ALBERTO CHAVEZ CARBAJAL
12032,2015,PRI,C. JUAN PEDRO SALGADO ROMAN
12032,2018,PRI,C. SERAFIN HERNANDEZ LANDA
12032,2021,PRI,C. SERAFIN HERNANDEZ LANDA
12033,1969,NA,C. JESÚS LUNA SÁNCHEZ
12033,1975,NA,C. JORGE SÁNCHEZ RAMÍREZ
12033,1978,NA,C. CARLOS PANTOJA ESCAMILLA
12033,1984,NA,C. GAUDENCIA APÓRTELA VELASCO
12033,1987,NA,C. ADRIÁN SALCEDO GÓMEZ
12033,1993,PRI,C. TIMOTEO DOMINGUEZ MALDONADO
12033,1996,PRI,DR. MARCOS CASTILLO PONCE
12033,1999,PRI,C. ALEJO RAMIREZ PACHECO
12033,2002,COALICIÓN,LIC. GUILLERMO VIRAFUENTES ROMERO
12033,2005,PRD,C. JUAN CARLOS GARCIA JIMENEZ
12033,2009,PRD,C. JUAN CARLOS MERINO GONZALEZ
12033,2012,GNU,C. JOHNNY SAUCEDO ROMERO
12033,2015,PRD,C. MARIO GARCIA FLORES
12033,2018,COAL.,C. ELPIDIO NAVA RODRIGUEZ
12033,2021,MORENA,C. AURELIO MENDEZ ROSALES
12034,1919,NA,C. PABLO MARTÍNEZ PASTRANA
12034,1927,NA,C. ANTONIO ABUNDES GONZALEZ
12034,1931,NA,C. PABLO MARTÍNEZ PASTRANA
12034,1933,NA,C. FERNANDO SOTOMAYOR
12034,1935,NA,C. IGNACIO MARBAN ROBLES
12034,1937,NA,C. JESÚS FIGUEROA ALCOCER
12034,1939,NA,C. PEDRO PORRAS OROPEZA
12034,1943,NA,C. GRACIANO ABUNDES
12034,1947,NA,C. EMILIO T. CASARRUBIAS
12034,1949,NA,C. JUVENAL ABUNDES BRITO
12034,1951,NA,C. IRINEO ARCE CADENAS
12034,1953,NA,C. VICENTE SÁNCHEZ SÁNCHEZ
12034,1955,NA,C. MANUEL URIZA MARBAN
12034,1957,NA,C. GONZALO VELAZCO ESTRADA
12034,1963,NA,C. ERASMO ELIZALDE ASTUDILLO
12034,1969,NA,C. EDUARDO FIGUEROA ESQUIVEL
12034,1972,NA,C. ROBERTO SOTO GARDUÑO
12034,1975,NA,C. ALFONSO TOLEDO FIGUEROA
12034,1978,NA,C. ROGELIO FIGUEROA ALCOCER
12034,1981,NA,C. ATENODORO ROBLES OCAMPO
12034,1984,NA,C. ESTHER VELAZCO GIRÓN
12034,1987,NA,C. LUIS TORIBIO CASARRUBIAS ESTRADA
12034,1990,NA,C. ANDRÉS ABUNDES ORIHUELA
12034,1993,PRI,C. MARIO OCAMPO VICARIO
12034,1996,PRI,C. JUAN MIGUEL NOVERON HERRERA
12034,1999,PRI,C. EDUARDO CASTRO VERGARA
12034,2002,COALICIÓN,C.P. JOSE LUIS AVILA LOPEZ
12034,2005,PRI,ING. HECTOR OCAMPO ARCOS
12034,2009,PRD,C. ISIDRO MIRANDA MADRID
12034,2012,PRI,C. NORBERTO FIGUEROA ALMAZO
12034,2015,PRI,C. JOSE LUIS AVILA LOPEZ
12034,2018,PRI,C. JOSE LUIS AVILA LOPEZ
12034,2021,MORENA,C. EDER NAJERA NAJERA
12035,1972,NA,C. ANTONIO JAIMES ATUNEZ
12035,1975,NA,C. SATURNINO MARTÍNEZ LUGO
12035,1978,NA,C. JULIO CÉSAR CATALÁN FLORES
12035,1981,NA,C. EMILIO ALONSO AVILÉS
12035,1993,PRI,C. JOSE LUIS ROMAN ROMAN
12035,1996,PRD,C. LAZARO MAZON ALONSO
12035,1999,NA,C. JUAN MUÑOZ CABALLERO
12035,2002,PRD,DR. LAZARO MAZON ALONSO
12035,2005,PRD,DR. ANTONIO SALVADOR JAIMES HERRERA
12035,2006,NA,C. ANTONIO S. JAIMES HERRERA
12035,2009,PRI,DR. RAUL TOVAR TAVERA
12035,2012,GNU,C. JOSE LUIS ABARCA VELAZQUEZ
12035,2015,PRI,C. ESTEBAN ALBARRAN MENDOZA
12035,2016,PRI,DR. HERON DELGADO CASTAÑEDA
12035,2018,MORENA,C. ANTONIO SALVADOR JAIMES HERRERA
12035,2021,COAL.,ARQ. DAVID GAMA PEREZ
12036,1919,NA,C. ZÓTICO MARÍN
12036,1943,NA,C. SANTA CRUZ MEDINA
12036,1945,NA,C. HIGINIO MERGA PELÁEZ
12036,1947,NA,C. JOSÉ REYES
12036,1949,NA,C. ALEJANDRO HESIQUIO MARTÍNEZ
12036,1951,NA,C. BULFRANO RODRÍGUEZ ÁLVAREZ
12036,1953,NA,C. EMILIO HESIQUIO LANCHE
12036,1955,NA,C. MARGARITO MARTÍNEZ RUÍZ
12036,1956,NA,C. EMILIO PERALTA BUSTOS
12036,1959,NA,C. FRANCISCO MEZA MONTES
12036,1961,NA,C. FRANCISCO APARICIO LÓPEZ
12036,1963,NA,C. JESÚS NOLASCO BUSTOS
12036,1966,NA,C. FROLLO GONZÁLEZ VILLANUEVA
12036,1969,NA,C. HONORIO LEAL CHÁVEZ
12036,1972,NA,C. QUIRINO HESIQUIO LANCHE
12036,1975,NA,C. RAFAEL MARTÍNEZ ÁLVAREZ
12036,1978,NA,C. EMILIO PERALTA RODRÍGUEZ
12036,1981,NA,C. ELEUTERIO GONZÁLEZ PERALTA
12036,1984,NA,C. MANUEL PABLO PERALTA RODRÍGUEZ
12036,1987,NA,C. ENRIQUE GONZÁLEZ JUÁREZ
12036,1990,NA,C. ROBERTO LEAL MARROQUÍN
12036,1993,PRI,C. APOLONIO ALVAREZ MONTES
12036,1996,PRI,C. ELIUTH GALEANA ALVAREZ
12036,1999,PRI,C. JAVIER ADRIAN APARICIO SOTO
12036,2002,PAN,C. NOE JAVIER JUAREZ
12036,2005,PRI,C. APOLONIO ALVAREZ MONTES
12036,2009,PRI,C.P. ORLANDO HESIQUIO CRUZ
12036,2012,PRD,C. OMAR GONZALEZ ALVAREZ
12036,2015,PAN,C. ELOY CARRASCO HESIQUIO
12036,2018,PVEM,C. APOLONIO ALVAREZ MONTES
12036,2021,PRD,C.P. OMAR GONZALEZ ALVAREZ
12037,1969,NA,C. SAÚL JAIMES MARTÍNEZ
12037,1972,NA,C. RAFAEL RODRÍGUEZ DEL OLMO
12037,1975,NA,C. CAMERINO FERNÁNDEZ SOTO
12037,1978,NA,C. TOMÁS CANO BLANCO
12037,1981,NA,C. AUSENCIA BLANCO RIVERA
12037,1984,NA,C. MATILDE HELIONORA PARRA TERÁN
12037,1987,NA,C. DAMIÁN CASTILLO RODRÍGUEZ
12037,1993,PRI,C. J. TRINIDAD RODARTE MENDOZA
12037,1996,PRI,PROFR. MIGUEL ANGEL TREVIÑO BUSTAMANTE
12037,1999,PRI,C. FLORIBERTO RODRIGUEZ ALVAREZ
12037,2002,PRD,C. RAFAEL CELIO BARRERA RODRIGUEZ
12037,2005,PRD,PROFR. ULISES RIOS CABRERA
12037,2006,NA,C. ULIOSES RÍOS CBRERA
12037,2009,PRI,PROFR. DARIO PEREZ MORALES
12037,2012,PRD,C. FILIBERTA HONELIA BARRERA BAHENA
12037,2015,PRI,C. VICTOR DELGADO NAVA
12037,2018,PRD,C. NAUCELIA CASTILLO BAUTISTA
12037,2021,PRD,C. NAUCELIA CASTILLO BAUTISTA
12038,1969,NA,C. JORGE R. BUSTOS ALDAMA
12038,1972,NA,C. JORGE ALLEC GALEANA
12038,1975,NA,C. GUMERSINDO GARCÍA MARTÍNEZ
12038,1978,NA,C. ARMANDO F GONZÁLEZ RODRÍGUEZ
12038,1981,NA,C. FIDEL GUTIÉRREZ GORDILLO
12038,1984,NA,C. JOSÉ LUIS MOSQUEDA NOGUEDA
12038,1987,NA,C. GABINO FERNÁNDEZ SERNA
12038,1990,NA,C. JORGE ALLEC GALEANA
12038,1993,PRI,C. ARMANDO FEDERICO GONZALEZ RODRIGUEZ
12038,1996,PRI,C. ERIC HUMBERTO FERNANDEZ GOMEZ
12038,1999,PRI,C. JORGE ALLEC GALEANA
12038,2002,PRD,C. AMADOR CAMPOS ABURTO
12038,2005,PRD,LIC. SILVANO BLANCO DEAQUINO
12038,2009,PRI,C. JOSE JUAN MEDINA GALEANA
12038,2012,PRI,C. ERIC FERNANDEZ BALLESTEROS
12038,2015,PRD,C. GUSTAVO GARCIA BELLO
12038,2018,PRI,C. JORGE SANCHEZ ALLEC
12038,2021,COAL.,C. JORGE SANCHEZ ALLEC
12039,1969,NA,C. JUVENCIO ESPÍRITU RAMÍREZ
12039,1972,NA,C. ANDRÉS MORALES SANTIAGO
12039,1975,NA,C. CELESTINO VELA GARCÍA
12039,1984,NA,C. ROGELIO ÁLVAREZ GONZÁLEZ
12039,1987,NA,C. ARQUÍMEDES MEZA GARCÍA
12039,1990,NA,C. MARCELINO ARIZMENDI FLORES
12039,1993,PRI,C. ALEJANDRO SANCHEZ RODRIGUEZ
12039,1996,PRD,C. JOSE JACOBO VALLE
12039,1999,PRD,C. ANTELMO BELLO HERNANDEZ
12039,2002,COALICIÓN,ARQ. ISMAEL PABLO AVILA RAMIREZ
12039,2005,PRD,C. HECTOR VELA CARBAJAL
12039,2009,PRD,M.C. PORFIRIO LEYVA MUÑOZ
12039,2012,PAN,C. ELIZABETH GUTIERREZ PAZ
12039,2015,PRD,C. LEONEL LEYVA MUÑOZ
12039,2018,MORENA,C. DELFINO TERRONES RAMIREZ
12039,2021,PRI,LIC. DIANA CAROLINA COSTILLA VILLANUEVA
12040,1972,NA,C. TORIBIO DONJUÁN VELEZ
12040,1975,NA,C. MANUEL CHÁVEZ ZAMORA
12040,1978,NA,C. SERAFÍN CASTILLO ALARCÓN
12040,1981,NA,C. AGUSTÍN ADAME ADAME
12040,1984,NA,C. ALBERTO MORALES ADAME
12040,1987,NA,C. JESÚS ABRAJAN ADAME
12040,1990,NA,C. HUMBERTO AGUILAR MARINO
12040,1993,PRI,C. CARLOS ARTURO ALARCON CABRERA
12040,1996,PRI,C. MARIO RAMIREZ MADORA
12040,1999,PRI,C. NOE ALARCON AGUILAR
12040,2002,PAN,C. LEOPOLDO RAMIRO CABRERA CHAVEZ
12040,2005,PRI,LIC. WILIBALDO VALENTE PASTOR
12040,2009,PRI,PROFR. ISIDRO ALARCON CATALAN
12040,2012,PRD,C. LEOPOLDO RAMIRO CABRERA CHAVEZ
12040,2015,PAN,C. ALFREDO ALARCON RODRIGUEZ
12040,2018,PRI,C. ISMAEL CASTULO GUZMAN
12040,2021,PAN,C. JORGE SAUL VILLA ADAME
12041,1972,NA,C. FRANCISCO PELÁEZ SÁNCHEZ
12041,1975,NA,C. SILVINO TITO MORÁN
12041,1978,NA,C. FIDEL CANTÚ FELICIANO
12041,1981,NA,C. ROMUALDO CARRASCO SÁNCHEZ
12041,1987,NA,C. OFILIO RUÍZ GALEANA
12041,1993,PRD,C. GUADALUPE VALENTINO LOPEZ CARRASCO
12041,1996,PRD,C. MELQUIADES GREGORIO RAMIREZ AVILA
12041,1999,NA,C. TEODORO TORRES GALEANA
12041,2002,PRD,C. APOLONIO CRUZ ROSAS
12041,2005,PRD,LIC. ZOTICO JERONIMO GARCIA
12041,2009,PRD,LIC. ALFREDO JERONIMO CRISTINO
12041,2012,PRD,C. ARISTOTELES TITO ARROYO
12041,2015,PT,C. SEBASTIAN RAMIREZ HERNANDEZ
12041,2018,MORENA,C. ABEL BRUNO ARRIAGA
12041,2021,PES,C. ACASIO FLORES GUERRERO
12042,1920,NA,C. BONIFACIO CABRERA
12042,1921,NA,C. RAFAEL ZACARÍAS
12042,1922,NA,C. CRISTÓBAL MIRANDA
12042,1923,NA,C. RAFAEL LOBATO
12042,1924,NA,C. RAFAEL ZACARÍAS
12042,1925,NA,C. MACARIO DÍAZ
12042,1928,NA,C. CENOBIO PACHECO
12042,1935,NA,C. MACARIO DÍAZ
12042,1936,NA,C. ALFONSO DÍAZ
12042,1938,NA,C. LUGARDO DÍAZ
12042,1939,NA,C. GABINO SALGADO
12042,1943,NA,C. FELIPE MIRANDA
12042,1945,NA,C. JULIÁN MORALES
12042,1947,NA,C. VICENTE MOYAO CUEVAS
12042,1949,NA,C. PONCIANO MORALES
12042,1950,NA,C. GENARO MUÑIZ
12042,1951,NA,C. FELIPE MIRANDA
12042,1954,NA,C. GREGORIO CAMACHO DEL MORAL
12042,1955,NA,C. JESÚS ALARCÓN
12042,1957,NA,C. PERFECTO LÓPEZ CIENFUEGOS
12042,1959,NA,C. SUSANO MIRANDA PARRA
12042,1960,NA,C. EDUARDO VEGA
12042,1961,NA,C. VICENTE MOYAO CUEVAS
12042,1962,NA,C. GUILLERMO CASTRO LÓPEZ
12042,1963,NA,C. PERFECTO LÓPEZ CIENFUEGOS
12042,1966,NA,C. MARTÍN MORALES ALONSO
12042,1969,NA,C. SÓCRATES SALGADO VALLE
12042,1972,NA,C. SOFÍA IGLESIAS JUÁREZ
12042,1975,NA,C. OLIVO MOCTEZUMA RODRÍGUEZ
12042,1978,NA,C. CORNELIO DÍAZ MIRANDA
12042,1981,NA,C. ELEUTERIO MUÑIZ MIRANDA
12042,1984,NA,C. EDILBERTO NAVA GARCÍA
12042,1987,NA,C. SOFÍA IGLESIAS JUÁREZ
12042,1989,NA,C. NAPOLEÓN CASTRO DE LA CRUZ
12042,1990,NA,C. GABRIEL DEL MORAL GARCÍA
12042,1992,NA,C. EDILBERTO NAVA GARCÍA
12042,1993,PRI,C. CRISOFORO NAVA BARRIENTOS
12042,1996,PRI,C. VICENTE ZACARIAS FLORES
12042,1999,PRI,C. FRANCISCO JAVIER SEBASTIAN GARCIA
12042,2002,COALICIÓN,LIC. ANTONIO VILIULFO MORALES IGLESIAS
12042,2005,PRD,C. GERARDO CELINO FLORES
12042,2009,CONVER.,C. FELICITAS MUÑIZ GOMEZ
12042,2012,PRD,C. JOSE GUADALUPE RIVERA OCAMPO
12042,2015,PMC,C. FELICITAS MUÑIZ GOMEZ
12042,2018,PRD,C. JENNY GONZALEZ OCAMPO
12042,2021,COAL.,C. JENNY GONZALEZ OCAMPO
12043,1969,NA,C. AGUSTÍN MONTEALEGRE
12043,1973,NA,C. SANTOS VITERVO CHÁVEZ
12043,1975,NA,C. RAFAEL MARTÍNEZ
12043,1978,NA,C. MARCELINO VÁZQUEZ MARTÍNEZ
12043,1981,NA,C. ANTONIO SAAVEDRA RÍOS
12043,1984,NA,C. FERMÍN ORTIZ MONTEALEGRE
12043,1987,NA,C. RAMIRO CONSTANTINO SIERRA
12043,1993,PRI,C. ENRIQUE ROJAS CANDIA
12043,1996,PRD,C. AGUSTIN MELENDEZ VAZQUEZ
12043,1999,PRI,C. SILVESTRE ROJAS CANDIA
12043,2002,PRD,LIC. SAUL RIVERA MERCENARIO
12043,2005,PRD,C. RUTILIO VITERVO AGUILAR
12043,2009,PRD,PROFR. ROBERTO GUEVARA MALDONADO
12043,2012,PRD,C. NEFTALI HERNANDEZ AGUILAR
12043,2015,PRD,C. MATIAS ORTIZ RODRIGUEZ
12043,2018,MORENA,C. ZEFERINO VILLANUEVA GALINDO
12043,2021,PT,C. IDELFONSO MONTEALEGRE VAZQUEZ
12044,1972,NA,C. FRANCISCO VALENSO ESPÍRITU
12044,1975,NA,C. AGUSTÍN BELLO BELLO
12044,1978,NA,C. JOSÉ ESPÍRITU CASTREJÓN
12044,1981,NA,C. MANUEL MUÑIZ PÉREZ
12044,1984,NA,C. HERIBERTO CUEVAS REYES
12044,1987,NA,C. SIXTO ALARCÓN NAVA
12044,1989,NA,C. RAÚL NAVA DAMIAN
12044,1993,PRI,C. MARCO ANTONIO CUEVAS REYES
12044,1996,PRI,C. BENJAMIN REYES VAZQUEZ
12044,1999,PRI,C. FELIX JIMENEZ CHAVARRIA
12044,2002,COALICIÓN,LIC. ISAIAS LOPEZ SANCHEZ
12044,2005,PRD,PROFR. DELFINO ALARCON BELLO
12044,2009,PRI,PROFRA. IMELDA ESPIRITU JIMENEZ
12044,2012,PRD,C. CEVERO ESPIRITU VALENZO
12044,2015,PVEM,C. JHOBANNY JIMENEZ MENDOZA
12044,2018,PVEM,C. JHOBANNY JIMENEZ MENDOZA
12044,2021,PVEM,C. GERARDO MOSSO LOPEZ
12045,1972,NA,C. EUSTORGIO SALGADO VENEGAS
12045,1975,NA,C. MIGUEL RENDÓN PANTALCON
12045,1978,NA,C. GENARO SÁNCHEZ RENDÓN
12045,1981,NA,C. VÍCTOR APRESA SALGADO
12045,1984,NA,C. ARMANDO PATRÓN JIMÉNEZ
12045,1987,NA,C. EDILBERTO JIMÉNEZ BARRERO
12045,1993,PRI,C. ROMULO JIMENEZ JIMENEZ
12045,1996,PRI,C. HECTOR APREZA PATRON
12045,1999,PRI,C. MANUEL SANCHEZ ROSENDO
12045,2002,COALICIÓN,PROFR. VICTOR APREZA SALGADO
12045,2005,PRI,PROFR. HECTOR ROMEO TORRES ORTEGA
12045,2009,PRD,C. JOSE OSEA ROSENDO SANCHEZ
12045,2012,PRI,C. EUSEBIO GONZALEZ RODRIGUEZ
12045,2015,PRI,C. SAUL APREZA PATRON
12045,2018,PRI,C. JOSE JUAN HERREJON ORTIZ
12045,2021,MORENA,C. MIGUEL REYES PATRON
12046,1969,NA,C. ADOLFO TRANI LÓPEZ
12046,1972,NA,C. FERNANDO LÓPEZ CARMONA
12046,1975,NA,C. ULISES ESTRADA VÁZQUEZ
12046,1978,NA,C. JOSÉ MA. ROBLES DE LA CRUZ
12046,1981,NA,C. JOSÉ ANGEL TORRES DEL CUETO
12046,1984,NA,C. DELFINO AGUIRRE RIVERO
12046,1987,NA,C. AMPARO SANDOVAL PIZA
12046,1993,PRI,C. JAIME LOPEZ JIMENEZ
12046,1996,PRI,M.V.Z. HUMBERTO RAFAEL ZAPATA AÑORVE
12046,1999,PRI,C. MARIO NAVARRETE GUTIERREZ
12046,2002,COALICIÓN,M.V.Z. FRANCISCO ESPINOZA HILARIO
12046,2005,PRI,LIC. EDUARDO MONTAÑO SALINAS
12046,2009,PRD,C. EFREN ADAME MONTALBAN
12046,2012,CPG,C. ANTONIO ATENOGENES VAZQUEZ RODRIGUEZ
12046,2015,C.C.,C. OMAR ESTRADA BUSTOS
12046,2018,PRI,C. EFREN ADAME MONTALVAN
12046,2021,COAL.,C. EFREN ADAME MONTALVAN
12047,1969,NA,C. REFUEL GAFFERE SALGADO
12047,1972,NA,C. EDILBERTO LÓPEZ TRUJILLO
12047,1975,NA,C. LEONICIO FIGUEROA SALGADO
12047,1978,NA,C. SALVADOR LÓPEZ FIGUEROA
12047,1981,NA,C. IGNACIO ALCÁNTARA ROGEL
12047,1984,NA,C. NOÉ LÓPEZ CÁRDENAS
12047,1987,NA,C. REFUEL GAFFERE SALGADO
12047,1993,PRI,C. EUSTORGIO FLORES CRUZ
12047,1996,PRI,C. EUSTORGIO SANCHEZ BELTRAN
12047,1999,PRI,C. RUBEN ARANDA ALVAREZ
12047,2002,COALICIÓN,C. CIRILO JULIAN OCAMPO VILLALOBOS
12047,2005,PRD,C.P. ADRIAN SALATIEL FLORES SOTO
12047,2009,PRI,C. EUSTORGIO SANCHEZ BELTRAN
12047,2012,PRD,C. FRANCISCO PRUDENCIO HERNANDEZ BASAVE
12047,2015,PRI,C. LORENIA ARMENTA ALVAREZ
12047,2018,MC,C. OLIVIA AZUCENA LOPEZ ROGEL
12047,2021,COAL.,C. AUSTREBERTA LOPEZ ROGEL
12048,1969,NA,C. RUBÉN RODRÍGUEZ ABURTO
12048,1972,NA,C. CELESTINO BRAVO GALEANA
12048,1975,NA,C. OLIVER VARGAS BLANCO
12048,1978,NA,C. AGAPITO GALEANA DE LA ROSA
12048,1981,NA,C. JULIÁN GUERRERO MASIEL
12048,1987,NA,C. FRANCISCO JAVIER RODRÍGUEZ ACEVES
12048,1993,PRI,C. ROGACIANO ALBA ALVAREZ
12048,1996,PRI,C. ALEJANDRO BRAVO ABARCA
12048,1999,PRI,C. JORGE RAMIREZ ESPINO
12048,2002,PRD,ING. FRANCISCO JAVIER RODRIGUEZ ACEVES
12048,2005,PRD,C. JOSE ANTONIO ARMENTA MIRALRIO
12048,2009,PRI,ARQ. JOSE ALBINO LACUNZA SANTOS
12048,2012,PRI,C. JORGE RAMIREZ ESPINO
12048,2015,C.C.,C. ARTURO GOMEZ PEREZ
12048,2018,COAL.,C. ESTEBAN CARDENAS SANTANA
12048,2021,PRI,C. PERFECTO JAVIER AGUILAR SILVA
12049,1919,NA,C. GUMERSINDO HERNÁNDEZ RODRÍGUEZ
12049,1939,NA,C. MIGUEL DÍAZ FIGUEROA
12049,1941,NA,C. DIMAS MEJÍA MACEDO
12049,1945,NA,C. JOSÉ CASTAÑEDA GARDUÑO
12049,1947,NA,C. REYES S. SÁNCHEZ
12049,1949,NA,C. MARGARITO FIGUEROA FIGUEROA
12049,1951,NA,C. CONSTANTINO F. ESTRADA
12049,1953,NA,C. FELIX VALOIS NAVA
12049,1955,NA,C. JOSÉ CASTAÑEDA GARDUÑO
12049,1956,NA,C. HABACUC REYNOSO ARIZMENDI
12049,1960,NA,C. ANTONIO ARIZMENDI FIGUEROA
12049,1963,NA,C. JESÚS CASTAÑEDA GARDUÑO
12049,1966,NA,C. CRISOFORO VARGAS DÍAZ
12049,1969,NA,C. VICENTE FIGUEROA RODRÍGUEZ
12049,1972,NA,C. RUBÉN BUSTOS MENDOZA
12049,1975,NA,C. JOSÉ VALOIS CASTAÑEDA
12049,1978,NA,C. ANTONIO MENDOZA CASTAÑEDA
12049,1981,NA,C. IGNACIO FIGUEROA SALGADO
12049,1984,NA,C. CARLOS RAÚL FIGUEROA
12049,1987,NA,C. ANTONIO MENDOZA CASTAÑEDA
12049,1990,NA,C. ARTURO ESTRADA ACOSTA
12049,1993,PRI,C. IGNACIO FIGUEROA SALGADO
12049,1996,PRI,M.V.Z. JOSE LUIS SORIANO CASTAÑEDA
12049,1999,PAN,C. EUSTAQUIO A. MARTINEZ MARTINEZ
12049,2002,COALICIÓN,C. HECTOR TOMAS BUSTOS ESTRADA
12049,2005,PRD,L.A.E. MARDONIO REYNA CASTAÑEDA
12049,2009,COAL.,LIC. IGNACIO PAULINO GARCIA FLORES
12049,2012,PAN,C. SANDRA VELAZQUEZ LARA
12049,2015,PRI,C. ELLERY GUADALUPE FIGUEROA MACEDO
12049,2018,COAL.,C. SANDRA VELAZQUEZ LARA
12049,2021,PAN,MTRA. SANDRA VELAZQUEZ LARA
12050,1969,NA,C. CARLOS MERCADO MARIANO
12050,1972,NA,C. CRISÓFORO DÍAZ ARIAS
12050,1978,NA,C. JUAN ALBARRAN CASTAÑEDA
12050,1981,NA,C. TIRSO CASTILLO MOLINA
12050,1984,NA,C. JUAN ALBARRAN CASTAÑEDA
12050,1987,NA,C. EDUARDO BAHENA BAHENA
12050,1993,PRI,C. ENRIQUE ROBLES ROMERO
12050,1996,PRD,C. VICTOR ADOLFO MOJICA WENCES
12050,1999,PRI,C. ANGEL PEREZ NAVARRO
12050,2002,COALICIÓN,C. AMBROSIO SOTO DUARTE
12050,2005,PRD,DR. VICTOR ADOLFO MOJICA WENCES
12050,2009,PRI,PROFR. JESUS CASTILLO ROMERO
12050,2012,PRI,C. REYNEL RODRIGUEZ MUÑOZ
12050,2015,C.C.,C. AMBROSIO SOTO DUARTE
12050,2016,C.C.,LIC. DANIEL BASULTO DE NOVA
12050,2018,PRI,C. REYNEL RODRIGUEZ MUÑOZ
12050,2021,PRI,C. CUAUHTEMOC MASTACHI AGUARIO
12051,1919,NA,C. ANTONIO HERNÁNDEZ SÁNCHEZ
12051,1951,NA,C. MEDARDO BELLO RAMÍREZ
12051,1953,NA,C. AURELIO MORAS SÁNCHEZ
12051,1955,NA,C. LEODEGARIO ZAVALA OJEDA
12051,1957,NA,C. FLORIANO RAMÍREZ SÁNCHEZ
12051,1960,NA,C. GORDIANO RAMÍREZ RODRÍGUEZ
12051,1963,NA,C. DARÍO GATICA CAMPOS
12051,1966,NA,C. DAVID MENDOZA NAVA
12051,1969,NA,C. ANGEL OJEDA RAMÍREZ
12051,1973,NA,C. JANUARIO RAMÍREZ CORONA
12051,1975,NA,C. LORENZO RODRÍGUEZ GODINES
12051,1978,NA,C. ANGEL OJEDA RAMÍREZ
12051,1981,NA,C. LEOBARDO TEJEDA DELOYA
12051,1984,NA,C. MANUEL PACHECO ROSAS
12051,1987,NA,PROFR. ARISTARCO PRUDENTE CORONA
12051,1990,NA,PROFR. JOSÉ RAMÍREZ CARVAJAL
12051,1993,PRI,C. EMILIO DURAN DURANTES
12051,1996,PRI,C. ELPIDIO PACHECO ROSAS
12051,1999,PRD,C. JESUS LEON CARBAJAL
12051,2002,PRD,C. BERNARDO ORTEGA JIMENEZ
12051,2005,PRD,LIC. NAPOLEON SILVA GARCIA
12051,2009,PVEM,ING. LEONEL ANGEL NAVA
12051,2012,PRI,C. ANTONIO NAVARRETE CORTEZ
12051,2015,PRD,C. ALBERTO RODRIGUEZ JIMENEZ
12051,2018,COAL.,C. CRISOFORO CASTRO CASTRO
12051,2021,COAL.,C. CRISOFORO CASTRO CASTRO
12052,1919,NA,C. FILIBERTO LARUMBE
12052,1947,NA,C. LEÓN OLGUÍN AGUILAR
12052,1949,NA,C. ALFREDO SOLÍS ESCAMILLA
12052,1953,NA,C. ALFONSO VÁZQUEZ ROJAS
12052,1955,NA,C. GELASIO CLEMENTE
12052,1957,NA,C. GILBERTO MEZA
12052,1960,NA,C. LEÓN OLGUÍN
12052,1969,NA,C. VICENTE GONZÁLEZ
12052,1972,NA,C. ESAÚ SOLIS GALINDO
12052,1975,NA,C. FLAVIO DOMÍNGUEZ NAVA
12052,1978,NA,C. JUAN REYES GIL
12052,1981,NA,C. AGUSTÍN SUCARILLO CORTES
12052,1984,NA,C. FRANCISCO JAVIER HERNÁNDEZ CAMPOS
12052,1987,NA,C. RAÚL GUILLEN PÉREZ VARGAS
12052,1990,NA,C. JESÚS BONIFACIO HUERTA MORA
12052,1992,NA,C. JOSÉ TRINIDAD CONTRERAS VELÍZ
12052,1993,PRI,C. LEONARDO MORALES LUNA
12052,1996,PRD,C. GERARDO REYES ORTEGA
12052,1999,PRI,DR. ABDIAS ACEVEDO ROJAS
12052,2002,PRD,LIC. GENARO VAZQUEZ SOLIS
12052,2005,PRI,C.P. SANTACRUZ NAVA LEZAMA
12052,2006,NA,C. SANTACRUZ NAVA LEZAMA
12052,2009,PRD,M.C. VICARIO PORTILLO MARTINEZ
12052,2012,CPG,C. ALEJANDRO CONTRERAS VELASCO
12052,2015,PMC,C. JAVIER VAZQUEZ GARCIA
12052,2018,PRI,C. AGUSTIN RICARDO MORALES
12052,2021,PT,C. ADAIR HERNANDEZ MARTINEZ
12053,1969,NA,C. JAVIER VILLALBA CHAVEZ
12053,1972,NA,C. PEDRO MANZANARES SABINO
12053,1975,NA,C. ARMANDO JUSTO CONTRERAS
12053,1978,NA,C. ISAURA VILLANUEVA CRUZ
12053,1981,NA,C. JOSÉ LUIS GARCÍA DAMIÁN
12053,1984,NA,C. JUAN LÓPEZ ALONSO
12053,1987,NA,C. BALTAZAR ARREDONDO HERNÁNDEZ
12053,1993,PRI,C. ARQUIMIDEZ SANDOVAL VAZQUEZ
12053,1996,PRI,DR. JAIME HEREDIA GUTIERREZ
12053,1999,PRI,C. CANTORBEY HERRERA LOZANO
12053,2002,PAN,C. FERNANDO SOTELO DEL CARMEN
12053,2005,PRI,DR. ARMANDO BIBIANO GARCIA
12053,2009,PRD,LIC. ARTURO HEREDIA AGATON
12053,2012,GNU,C. GUSTAVO VILLANUEVA BARRERA
12053,2015,PRI,C. JUAN CARLOS MOLINA VILLANUEVA
12053,2018,COAL.,C. TOMAS HERNANDEZ PALMA
12053,2021,PRD,LIC. TOMAS HERNANDEZ PALMA
12054,1972,NA,C. PABLO NAVA NAVARRO
12054,1975,NA,C. BENJAMÍN MENDOZA CONTRERAS
12054,1978,NA,C. SENAIDO REZA OLIVARES
12054,1981,NA,C. BENITO TÉLLEZ OCAMPO
12054,1984,NA,C. JOSÉ SLLIN QUEZADA
12054,1987,NA,C. FELIPE DOMÍNGUEZ CELSO
12054,1993,PRI,C. NESTOR INOCENTE MARQUEZ MORANTE
12054,1996,PRI,C. EGDY JULIAN GOMEZ
12054,1999,PRI,C. BOLIVAR MENDOZA DUARTE
12054,2002,PRD,C. DANIEL TORRES GARCIA
12054,2005,PRD,C. MIGUEL JAIMES PALACIOS
12054,2009,PRI,ING. EDGY JULIAN GOMEZ
12054,2012,CPG,C. SAUL BELTRAN OROZCO
12054,2015,PRD,C. JUAN MENDOZA ACOSTA
12054,2018,COAL.,C. JUAN MENDOZA ACOSTA
12054,2021,PRD,C. CONRADO MENDOZA ALMEDA
12055,1969,NA,C. JOSÉ GARCÍA CHÁVEZ
12055,1972,NA,C. ALFREDO FIGUEROA BAHENA
12055,1975,NA,C. JOSÉ ANTONIO ORTEGA FIGUEROA
12055,1978,NA,C. GUSTAVO MARTÍNEZ MARTÍNEZ
12055,1981,NA,C. RICARDO FIGUEROA RODRÍGUEZ
12055,1984,NA,C. JOSÉ FERNANDO BENITEZ LÓPEZ
12055,1987,NA,C. MANUEL SAIDI GONZÁLEZ
12055,1993,PRI,ARQ. MARIO HIPOLITO FLORES PEREZ
12055,1996,PAN,C. MARCOS EFREN PARRA GOMEZ
12055,1999,PRI,C. ISSAC OCAMPO FERNANDEZ
12055,2002,COALICIÓN,C. ABRAHAM PONCE GUADARRAMA
12055,2005,PAN,LIC. RAMIRO JAIMES GOMEZ
12055,2009,PRI,C.P. MARCO ANTONIO SIERRA MARTINEZ
12055,2012,PRI,C. SALOMON MAJUL GONZALEZ
12055,2015,PRI,C. OMAR JALIL FLORES MAJUL
12055,2018,COAL.,C. MARCOS EFREN PARRA GOMEZ
12055,2021,FXM,C. MARIO FIGUEROA MUNDO
12056,1969,NA,C. CECILIO RAMÍREZ MORALES
12056,1972,NA,C. EUCARIO RAMÍREZ MATILDE
12056,1975,NA,C. FACUNDO MENDOZA MENESES
12056,1978,NA,C. RODRIGO RAMÍREZ RAMÍREZ
12056,1981,NA,C. ENRIQUE RAMÍREZ CRUZ
12056,1984,NA,C. ROBERTO RAMÍREZ NAVA
12056,1987,NA,C. ROGELIO RAMÍREZ AVILÉS
12056,1993,PRI,C. MARGARITO NABOR AVILA CHUPIN
12056,1996,PRI,C. FRANCISCO JAVIER POBLETE RAMIREZ
12056,1999,PRI,C. JOSE ESPINOZA MENDOZA
12056,2002,COALICIÓN,LIC. IGNACIO LUNA GERONIMO
12056,2005,PRD,LIC. ALVARO MORALES GARCIA
12056,2009,PRI,LIC. JUVENAL POBLETE VELAZQUEZ
12056,2012,PVEM,C. MANUEL QUIÑONEZ CORTES
12056,2015,PAN,C. RENE MORALES LEYVA
12056,2018,MORENA,C. HENOS ROQUE RAMIREZ
12056,2021,PVEM,C. CARMEN ILIANA CASTILLO AVILA
12057,1919,NA,C. DIMAS ARZETA CISNEROS
12057,1969,NA,C. RAMIRO MENA ALEJANDRI
12057,1972,NA,C. MANUEL DE LA O. JACINTO
12057,1975,NA,C. RAFAEL ARMENTA ORTIZ
12057,1978,NA,C. ANTONIO H. CADENA SOLÍS
12057,1981,NA,C. ABELARDO RAMOS TAPIA
12057,1984,NA,C. ABELARDO CAMACHO CLAUDEVILLE
12057,1987,NA,C. JESÚS MANUEL AYERDI ABARCA
12057,1988,NA,C. JOSÉ GUADALUPE SOLÍS GALEANA
12057,1990,NA,C. SALVADOR FLORES BELLO
12057,1992,NA,C. SANDRA B. OCAMPO HERNÁNDEZ
12057,1993,PRI,C. ROSALIO NAVARRETE UREÑA
12057,1996,PRI,C. CRESENCIO FELIPE ABARCA HERRERA
12057,1999,NA,C. SANDRA B. OCAMPO HERNÁNDEZ
12057,2002,COALICIÓN,C. JESUS ORBE TORRES
12057,2005,PRD,ING. ELFEGO MARTINEZ GONZALEZ
12057,2009,PRI,LIC. FRANCISCO JAVIER LOPEZ MANDUJANO
12057,2012,GNU,C. CRISOFORO OTERO HEREDIA
12057,2015,PRI,C. LEOPOLDO SOBERANIS HERNANDEZ
12057,2018,COAL.,C. JESUS YASIR DELOYA DIAZ
12057,2021,COAL.,C. JESUS YASIR DELOYA DIAZ
12058,1969,NA,C. RAÚL RODRÍGUEZ BUSTAMANTE
12058,1972,NA,C. SALVADOR SALGADO URIOSTEGUI
12058,1975,NA,C. MARÍA SALGADO ROMÁN
12058,1978,NA,C. GUALDO OJEDA SÁNCHEZ
12058,1981,NA,C. MIGUEL CABRERA R.
12058,1984,NA,C. HÉCTOR ROMÁN BAHENA
12058,1987,NA,C. MANUEL SALGADO CUEVA
12058,1993,PRD,C. ANDRES ANTUNEZ ARREOLA
12058,1996,PRD,PROFR. MODESTO BRITO GONZALEZ
12058,1999,PRD,C. UBALDO SALGADO MOJICA
12058,2002,PRD,PROFR. MODESTO BRITO GONZALEZ
12058,2005,PRD,C. TIMOTEO MANJARREZ MEDINA
12058,2009,PRD,LIC. GABRIEL OLMO SALGADO
12058,2012,GNU,C. IGNACIO DE JESUS VALLADARES SALGADO
12058,2015,PRD,C. ROBELL URIOSTEGUI PATIÑO
12058,2018,COAL.,C. EFREN ANGEL ROMERO SOTELO
12058,2021,COAL.,ARQ. HOMERO HURTADO FLORES
12059,1972,NA,C. ZEFERINO LOZANO REYES
12059,1975,NA,C. JOSÉ CAMACHO GONZÁLEZ
12059,1978,NA,C. ORALIA GÓMEZ SALGADO
12059,1981,NA,C. JUAN OCAMPO LOME
12059,1984,NA,C. HUMBERTO ORIHUELA
12059,1987,NA,C. PEDRO AUDOMARO RAMÓN AYALA
12059,1993,PRI,C. JUAN SACRAMENTO MORALES GUERRERO
12059,1996,PRI,C. DANIEL GARCIA PASTRANA
12059,1999,PRI,C. RAFAEL BENITEZ VILLALBA
12059,2002,PRD,C. PABLO LANDA SOTELO
12059,2005,PRI,LIC. IGNACIO OCAMPO ZAVALETA
12059,2009,PRI,DR. IGNACIO GONGORA LIZAMA
12059,2012,PAN,C. ANTONIO GALARZA ZAVALETA
12059,2015,PAN,C. JULIO ALBERTO GALARZA CASTRO
12059,2018,PRI,C. IGNACIO OCAMPO ZAVALETA
12059,2021,PAN,PROFR. FELIX LOPEZ OLIVARES
12060,1969,NA,C. ANTONIO JUÁREZ CERVANTES
12060,1972,NA,C. ROMAN HURTADO VÉRTIZ
12060,1975,NA,C. FELIPE CASTILLO FLORES
12060,1978,NA,C. RAMIRO PAVÓN RUIZ
12060,1984,NA,C. NOEL LANDA ARCE
12060,1987,NA,C. RAMÓN HURTADO VÉRTIZ
12060,1993,PRI,C. FELIPE CASTILLO FLORES
