uniqueid,year,incumbent_party_inafed,incumbent_candidate_inafed
16111,2004,PRD,LIC. ANTONIO ABAD MARTINEZ
16111,2007,C.C.,ING. J. JESUS HERNANDEZ RODRIGUEZ
16111,2011,C.C.,C. CARLOS SANDOVAL PORTUGAL
16111,2015,COAL.,C. JUAN MARTIN CARDONA TALAVERA
16111,2018,PRI,C. JOSE RODRIGUEZ BACA
16111,2021,COAL.,C. ITZEL GAONA BEDOLLA
16112,1992,PRI,LIC. ALDO EMILIO TELLO CARRILLO
16112,1995,PAN,C. CARLOS ZEPEDA MORALES
16112,1998,PRI,C.P. ARMANDO RUIZ SANTANA
16112,2001,CUPM,C. MARIA DE LOURDES JIMENEZ CORONEL
16112,2004,COALICIÓN,C.P. LEOPOLDO MARTINEZ RUIZ
16112,2007,PRI,LIC. SONIA ANGELICA RIVAS ESPITIA
16112,2011,PRI,C. JUAN CARLOS CAMPOS PONCE
16112,2015,COAL.,C. CARLOS HERRERA TELLO
16112,2018,COAL.,C. CARLOS HERRERA TELLO
16112,2021,COAL.,C. JUAN ANTONIO IXTLAHUAC ORIHUELA
16113,1992,PRD,C. MARIANO ROBLEDO POLINA
16113,1995,PRD,C. ENRIQUE TORRES CUADROS
16113,1998,PRI,C. SALVADOR AGABO PEREZ
16113,2001,CUPM,ING. GUSTAVO AVILA VAZQUEZ
16113,2004,PRD,C. JOSE M. TORRES ROBLEDO
16113,2007,PRI,C. ALEJANDRO AVILEZ VALADEZ
16113,2011,COAL.,C. JUAN MANUEL POLINA ARRIAGA
16113,2015,PRD,C. GUSTAVO AVILA VAZQUEZ
16113,2018,PVEM,C. RUBEN ROBLEDO AGABO
16113,2021,PVEM,C. RUBEN ROBLEDO AGABO
