uniqueid,year,incumbent_party_inafed,incumbent_candidate_inafed
19001,1939,NA,C. WENCESLAO GARZA ESCAMILLA
19001,1941,NA,C. DANIEL CANTÚ CANTÚ
19001,1944,NA,C. GREGORIO GUTIÉRREZ VILLARREAL
19001,1946,NA,C. WENCESLAO GARZA ESCAMILLA
19001,1948,NA,C. FAUSTINO CANTÚ
19001,1950,NA,C. CIPRIANO CANTÚ ELIZONDO
19001,1952,NA,C. EVARISTO GARZA
19001,1955,NA,C. WILFREDO CANTÚ
19001,1958,NA,C. ENRIQUE VILLARREAL MACILLAS
19001,1961,NA,C. FRANCISCO GUTIÉRREZ OSUNA
19001,1964,NA,C. CIRILO RINCÓN OLIVO
19001,1967,NA,C. APOLONIO C. ELIZONDO CANTÚ
19001,1970,NA,C. JUAN ALBERTO GAZA NIÑO
19001,1972,NA,C. AURELIA GÁMEZ RINCÓN
19001,1974,NA,C. OZIEL SOLÍS RAMÍREZ
19001,1977,NA,C. BALTAZAR GARZA SALÁIS
19001,1980,NA,C. WENCESLAO GARZA ESCAMILLA
19001,1983,NA,C. SEVERA CANTÚ VILLARREAL
19001,1986,NA,C. ARMANDO GÁMEZ RINCÓN
19001,1989,NA,C. SEVERA CANTÚ VILLARREAL
19001,1992,PRI,C. VICTOR ELIZONDO CANTU
19001,1995,PRI,C. ENRIQUE VILLARREAL GUTIERREZ
19001,1997,PRI,C. SEVERA CANTU VILLARREAL
19001,2000,PRI,C. DAVID ENRIQUE MILAN RAMOS
19001,2003,CAC,C. DAVID MILAN RIVERA
19001,2006,AXM,C. JAIME VILLARREAL RAMIREZ
19001,2009,JXNL,C. ENRIQUE VILLARREAL GUTIERREZ
19001,2012,PRD,C. JOSE FELIX ALEMAN CASTILLO
19001,2015,CPYB,C. CRISTINA ALEMAN AGUILAR
19001,2018,COAL.,C. KARINA LISSETTE VILLARREAL RAMÍREZ
19001,2021,PAN,C. REYNALDO JAVIER CANTU MONTES
19002,1919,NA,C. CARLOS C. NAÑEZ
19002,1939,NA,C. GIL CADENA
19002,1941,NA,C. FÉLIX SALINAS
19002,1943,NA,C. JUAN CANTÚ GONZÁLEZ
19002,1946,NA,C. FRANCISCO RODRÍGUEZ
19002,1949,NA,C. HERMELINDO CHAPA QUIROGA
19002,1952,NA,C. PEDRO SALINAS SÁENZ
19002,1955,NA,C. RAÚL MOLINA POMPA
19002,1958,NA,C. ROBERTO VELA GARZA
19002,1961,NA,C. JUAN DE DIOS GONZÁLEZ CHAPA
19002,1964,NA,C. VICENTE CANALES FERNÁNDEZ
19002,1967,NA,C. FRANCISCO GARCÍA CANTÚ
19002,1970,NA,C. J. GUADALUPE CANALES FERNÁNDEZ
19002,1972,NA,C. VICENTE CANALES GARZA
19002,1974,NA,C. JUAN DE DIOS GONZÁLEZ CHAPA
19002,1977,NA,C. ANTONIO RAMOS GARZA
19002,1980,NA,C. OSCAR SALINAS VELA
19002,1983,NA,C. JUAN JOSÉ SALINAS GARCÍA
19002,1986,NA,C. HERIBERTO CERNA CADENA
19002,1989,NA,C. REYNALDO CANALES VELA
19002,1992,PRI,C. JUAN JOSE SALINAS GARCIA
19002,1995,PRI,C. ELIO MOLINA SALINAS
19002,1997,PRI,C. VICENTE CANALES CANTU
19002,2000,PAN,C. IGNACIO DE JESUS CASTELLANOS RAMOS
19002,2003,CAC,C. VICENTE CANALES CANTU
19002,2006,AXM,C. JOSE ISRAEL GONZALEZ RODRIGUEZ
19002,2009,JXNL,C. JOSE GUADALUPE GARCIA GARZA
19002,2012,CPNL,C. JOSE ISRAEL GONZALEZ RODRIGUEZ
19002,2015,PAN,C. JOSE LUIS GARCIA MONTEMAYOR
19002,2018,PAN,LIC. IGNACIO CASTELLANOS AMAYA
19002,2021,PAN,C. IGNACIO CASTELLANOS AMAYA
19003,1919,NA,C. TIMOTEO GARCÍA GARCÍA
19003,1949,NA,C. ISAÍAS OLIVARES PEÑA
19003,1952,NA,C. SEVERO E. PEÑA
19003,1955,NA,C. LUCIANO GONZÁLEZ
19003,1958,NA,C. ZARAGOZA RÍOS VERA
19003,1961,NA,C. FELICIANO GUTIÉRREZ FLORES
19003,1964,NA,C. ISAÍAS OLIVARES PEÑA
19003,1967,NA,C. TIMOTEO RÍOS GARCÍA
19003,1970,NA,C. HOMERO ELIZONDO PEÑA
19003,1972,NA,C. JOSÉ LUIS OLIVARES PEÑA
19003,1974,NA,C. DONACIANO GUTIÉRREZ GARZA
19003,1977,NA,C. ROGELIO PEÑA SALINAS
19003,1980,NA,C. FELICIANO GUTIÉRREZ FLORES
19003,1983,NA,C. JOSÉ EVELIO PÉREZ ALANÍS
19003,1986,NA,C. OSCAR ALANIS LEAL
19003,1989,NA,C. EDILBERTO PEÑA PEÑA
19003,1992,PRI,C. RENE ROLANDO PEÑA GARCIA
19003,1995,PRI,C. JORGE LUIS PEÑA PEÑA
19003,1997,PRI,C. JESUS SALVADOR PEÑA ALANIS
19003,2000,PAN,C. RUBEN DARIO PASTRANA GUERRERO
19003,2003,CAC,C. JORGE LUIS PEÑA PEÑA
19003,2006,PAN,C. RUBIA IDALIA QUINTANILLA TIJERINA
19003,2009,JXNL,C. ALBERTO LOPEZ PEÑA
19003,2012,CPNL,C. JORGE LUIS PEÑA PEÑA
19003,2015,PRI,C. RODOLFO GARCIA MARTINEZ
19003,2018,PAN,C. JORGE LUIS PEÑA PEÑA
19003,2021,PMC,C. ADOLFO LEAL SALINAS
19004,1919,NA,C. JUAN ALONSO GARCÍA MOYA
19004,1939,NA,C. BAUDELIO E. SALAZAR GARZA
19004,1941,NA,C. CIRO TAMEZ LOZANO
19004,1943,NA,C. CRUZ RODRÍGUEZ CAVAZOS
19004,1946,NA,C. ROGELIO SALAZAR M.
19004,1948,NA,C. HERMENEGILDO LEAL
19004,1952,NA,C. JOSÉ TAMEZ LEAL
19004,1955,NA,C. ROGELIO SALAZAR MARTÍNEZ
19004,1958,NA,C. TOBÍAS VILLALÓN CAVAZOS
19004,1961,NA,ING. ROGELIO SALAZAR CAVAZOS
19004,1964,NA,C. RAMÓN FLORES AGUIRRE
19004,1967,NA,C. HÉCTOR TAMEZ RODRÍGUEZ
19004,1970,NA,C. DAVID CARDOSO TAMEZ
19004,1972,NA,PROFR. RUBÉN G. CAVAZOS CARDOSO
19004,1974,NA,C. GERARDO H. LEAL SILVA
19004,1977,NA,C. ANTONIO JAVIER CAVAZOS FLORES
19004,1980,NA,C. GILBERTO TAMEZ RODRÍGUEZ
19004,1983,NA,LIC. JORGE SALAZAR SUÁREZ
19004,1986,NA,C. ROBERTO AGUIRRE VEGA
19004,1989,NA,LIC. JUVENTINO FERNÁNDEZ GONZÁLEZ
19004,1992,NA,C. JORGE HERIBERTO SALAZAR SALAZAR
19004,1995,PRI,C. JOSE LUIS RODRIGUEZ CAVAZOS
19004,1997,PAN,LIC. RAMIRO TAMEZ MARTINEZ
19004,2000,PAN,C. ADRIAN ANTONIO CAVAZOS PARRA
19004,2003,CAC,C. SERGIO ALEJANDRO ALANIS MARROQUIN
19004,2006,AXM,C. LUIS GERARDO MARROQUIN SALAZAR
19004,2009,JXNL,C. JORGE ALBERTO SALAZAR SALAZAR
19004,2012,CPNL,C. JAIME SALAZAR MARROQUIN
19004,2015,PAN,C. SILVERIO MANUEL FLORES LEAL
19004,2018,PRI,LIC. EVA PATRICIA SALAZAR MARROQUÍN
19004,2021,COAL.,LIC. EVA PATRICIA SALAZAR MARROQUIN
19005,1919,NA,C. EUGENIO GARCÍA ESTRADA
19005,1940,NA,C. TOMÁS D. HINOJOSA
19005,1941,NA,C. RAFAEL GARCÍA GALÁN
19005,1943,NA,C. CRISÓFORO SERNA
19005,1946,NA,C. JOSÉ QUINTERO RODRÍGUEZ
19005,1949,NA,C. AVELINO DÁVALOS
19005,1952,NA,C. HELEODORO LOZANO GONZÁLEZ
19005,1955,NA,C. MARTÍN MARTÍNEZ PÉREZ
19005,1958,NA,C. LUIS ROBLES ALVARADO
19005,1961,NA,C. FERNANDO ALEJANDRO REYES
19005,1964,NA,C. MANUEL GARZA FALCÓN
19005,1967,NA,C. FRANCISCO P. LAZCANO
19005,1970,NA,C. MARTÍN MARTÍNEZ PÉREZ
19005,1972,NA,C. GONZALO S. MONTEMAYOR
19005,1974,NA,C. JOSÉ GUADALUPE TORRES N.
19005,1977,NA,C. JUAN E. MALDONADO P.
19005,1980,NA,C. FORTUNATO MONTEMAYOR LOZANO
19005,1983,NA,C. FRANCISCO Z. URTEAGA
19005,1984,NA,C. MARÍA DEL ROSARIO TIJERINA
19005,1986,NA,C. FORTUNATO DE LA GARZA RUVALCABA
19005,1992,PRI,C. JESUS GONZALEZ LOPEZ
19005,1995,PRI,C. JOSE ANTONIO GARCIA CERVANTES
19005,1997,PRI,C. MUCIO MAURICIO GALLEGOS
19005,2000,PAN,C.P. JOSE GERARDO MONTEMAYOR GARZA
19005,2003,CAC,C. MUCIO MAURICIO GALLEGOS
19005,2006,AXM,C. DESIDERIO URTEAGA ORTEGON
19005,2009,PAN,C. SANTOS JAVIER GARZA GARCIA
19005,2012,CPNL,C. DESIDERIO URTEAGA ORTEGON
19005,2015,PRI,C. JUAN MANUEL MORTON GONZALEZ
19005,2018,PRI,C. DESIDERIO URTEAGA ORTEGÓN
19005,2021,PRI,LIC. DESIDERIO URTEAGA ORTEGON
19006,1919,NA,C. ISMAEL GARZA CÁRDENAS
19006,1939,NA,C. ADOLFO G. GARZA
19006,1942,NA,C. ISMAEL GARZA GUAJARDO
19006,1943,NA,C. MANUEL GARZA ZAMBRANO
19006,1946,NA,C. ELÍAS FLORES GARZA
19006,1949,NA,C. ARMANDO ELIZONDO ZAMBRANO
19006,1952,NA,C. LUIS GARZA ELIZONDO
19006,1955,NA,C. RUBÉN GARCÍA GARZA
19006,1958,NA,C. JUAN LOZANO GUAJARDO
19006,1961,NA,C. LOMBARDO LOZANO GUAJARDO
19006,1964,NA,C. GILDARDO GUAJARDO GUAJARDO
19006,1967,NA,C. AARÓN LOZANO GUAJARDO
19006,1970,NA,C. EDMUNDO GUAJARDO LOZANO
19006,1972,NA,C. FRANCISCO ELIZONDO GONZÁLEZ
19006,1974,NA,C. LUIS GARZA GARZA
19006,1977,NA,C. RICARDO ELIZONDO TREVIÑO
19006,1980,NA,C. FRANCISCO ESCAMILLA MARTÍNEZ
19006,1983,NA,C. JOSÉ RENÉ GUAJARDO GUAJARDO
19006,1986,NA,C. LOMBARDO GUAJARDO GUAJARDO
19006,1989,NA,C. FRANCISCO ELIZONDO SEPÚLVEDA
19006,1992,PRI,C.P. RAYMUNDO FLORES ELIZONDO
19006,1995,PRI,C. LOMBARDO V. GUAJARDO GUAJARDO
19006,1996,NA,C. ANA ROSA HERNÁNDEZ CANTÚ
19006,1997,PRI,C. JESUS RAFAEL GARCIA GARZA
19006,2000,PRI,LIC. CESAR GARZA VILLARREAL
19006,2003,CAC,C. JOSE ANTONIO ELIZONDO GARZA
19006,2006,AXM,C. RAYMUNDO FLORES ELIZONDO
19006,2009,JXNL,C. BENITO CABALLERO GARZA
19006,2012,CPNL,C. RAYMUNDO FLORES ELIZONDO
19006,2015,PRI,C. OSCAR ALBERTO CANTU GARCIA
19006,2018,PRI,C. CÉSAR GARZA VILLARREAL
19006,2021,COAL.,LIC. CESAR GARZA VILLAREAL
19007,1919,NA,C. JOSÉ SANTOS ORTEGA
19007,1952,NA,C. ENEDINO MARTÍNEZ
19007,1955,NA,C. JOSÉ MIRELES
19007,1958,NA,C. JOSÉ DE JESÚS MARTÍNEZ
19007,1961,NA,C. SANTIAGO REYES BANDA
19007,1964,NA,C. SANTIAGO MENDOZA
19007,1967,NA,C. DAVID PÉREZ
19007,1970,NA,C. CELEDONIO VÁZQUEZ
19007,1972,NA,C. FRANCISCO GALVÁN ALEMÁN
19007,1974,NA,C. ANDRÉS GUERRERO DEL TORO
19007,1977,NA,C. CELEDONIO VÁZQUEZ
19007,1980,NA,C. ARTURO DUQUE
19007,1983,NA,C. BENITO PÉREZ FLORES
19007,1986,NA,C. ANTONIO FLORES ESPINOSA
19007,1990,NA,C. PEDRO ESPINOSA PEÑA
19007,1992,PRI,C. RAMIRO ORTEGA GUERRERO
19007,1994,PRI,C. SALVADOR VACA OBREGON
19007,1995,PRI,C. SALVADOR VACA OBREGON
19007,1997,PRI,C. JOSE ELIGIO DEL TORO OROZCO
19007,2000,PRI,PROFR. ROBERTO JAVIER GONZALEZ PORRAS
19007,2003,CAC,C. JOSE ELIGIO DEL TORO OROZCO
19007,2006,AXM,C. ARTURO ALEMAN MARTINEZ
19007,2009,JXNL,C. RAFAEL FLORES VILLANUEVA
19007,2012,CPNL,C. GASPAR SALATIEL DEL TORO OROZCO
19007,2015,APTS,C. SABINO HERNANDEZ URBINA
19007,2018,PRI,C. GASPAR SALATIEL DEL TORO OROZCO
19007,2021,COAL.,C. MARIA FRANCISCA ARGUELLO QUIÑONES
19008,1919,NA,C. LEOPOLDO GUTIÉRREZ SANTOS
19008,1946,NA,C. MARIO CANALES SÁENZ
19008,1949,NA,C. LEOPOLDO GUTIÉRREZ SANTOS
19008,1952,NA,C. AMANIEL SANTOS CÁRDENAS
19008,1955,NA,C. NATIVIDAD GONZÁLEZ TREVIÑO
19008,1958,NA,C. VALENTÍN BAUTISTA
19008,1961,NA,C. OSCAR SEPÚLVEDA G.
19008,1964,NA,C. FLAVIO SANTOS CÁRDENAS
19008,1967,NA,C. PILAR HERNÁNDEZ FLORES
19008,1970,NA,C. OLIVERIO DE LA GARZA
19008,1972,NA,C. RAMÓN GONZÁLEZ MAZCORRO
19008,1974,NA,C. REBECA GONZÁLEZ GUTIÉRREZ
19008,1977,NA,C. ARTURO DE LUNA
19008,1980,NA,C. ARNULFO SEPÚLVEDA VILLARREAL
19008,1983,NA,C. AMÉRICO BOTELLO GÓMEZ
19008,1986,NA,C. SERGIO MORALES TREVIÑO
19008,1989,NA,C. MARÍA DE LA LUZ HERRERA MUÑOZ
19008,1992,PRI,C. ARNULFO SEPULVEDA VILLARREAL
19008,1995,PRI,PROFR. ARTEMIO HERNANDEZ SOLIS
19008,1997,PAN,C. JORGE SANTOS GUTIERREZ
19008,2000,PAN,C. NORMA YOLANDA ROBLES ROSALES
19008,2003,PAN,C. JOSE B. GOMEZ RODRIGUEZ
19008,2006,PAN,C. JORGE SANTOS GUTIERREZ
19008,2009,PAN,C. OSCAR ARTURO GARCIA CASTILLO
19008,2012,CPNL,C. ADRIAN GALVAN RODRIGUEZ
19008,2015,PAN,C. MARIO ALFONSO RESENDEZ GARZA
19008,2018,PNA,C. LUIS FELIPE GARCÍA BOTELLO
19008,2021,PAN,C. MARIO ALFONSO RESENDEZ GARZA
19009,1946,NA,C. ALBERTO RODRÍGUEZ DÁVILA
19009,1949,NA,C. ANTONIO RODRÍGUEZ GUTIÉRREZ
19009,1952,NA,C. JUVENTINO CANTÚ LEAL
19009,1955,NA,DR. JOAQUÍN VALLE RAMÍREZ
19009,1958,NA,C. ALBERTO GALVÁN GALVÁN
19009,1961,NA,C. JOSÉ MARÍA GONZÁLEZ GONZÁLEZ
19009,1964,NA,C. JOSÉ CANTÚ VALERA
19009,1967,NA,C. JESÚS CABRERA GARCÍA
19009,1970,NA,C. AMÉRICO MONTEMAYOR GARZA
19009,1972,NA,C. SERGIO DE LOS SANTOS GARZA
19009,1974,NA,C. RAÚL DE LEÓN CANTÚ
19009,1977,NA,C. FLORENTINO GARZA SALAZAR
19009,1980,NA,C. AMÉRICO MONTEMAYOR GARZA
19009,1983,NA,C. RAFAEL RODRÍGUEZ DE LEÓN
19009,1986,NA,C. VALENTÍN TAMEZ ENRÍQUEZ
19009,1989,NA,C. JUAN JOSÉ RAMÍREZ VIERA
19009,1992,NA,C. EDELMIRO GONZÁLEZ GARCÍA
19009,1995,PAN,C. EDELMIRO CANTU SADA
19009,1997,PRI,C. JOSE JUAN CANTU GARCIA
19009,2000,PRI,C.P. JOSE LUIS LOZANO FERNANDEZ
19009,2003,CAC,C. JESUS FRANCISCO LOZANO FERNANDEZ
19009,2006,PAN,C. EDELMIRO CANTU SADA
19009,2009,JXNL,C. EDUARDO JAVIER DE LA GARZA LEAL
19009,2012,CPNL,C. JOSE EMETERIO ARIZPE TELLES
19009,2015,PAN,C. JOSE SANTIAGO PRECIADO ROBLES
19009,2018,COAL.,C. ERNESTO JOSÉ QUINTANILLA VILLARREAL
19009,2021,PAN,C. COSME JULIAN LEAL CANTU
19010,1964,NA,C. RAMÓN GONZÁLEZ VILLARREAL
19010,1967,NA,C. FELIPE VILLARREAL GONZÁLEZ
19010,1970,NA,C. RUBÉN VILLARREAL VILLARREAL
19010,1974,NA,C. OSWALDO VILLARREAL
19010,1977,NA,C. EUSEBIO FLORES GARZA
19010,1980,NA,C. RAMÓN VILLARREAL VILLARREAL
19010,1983,NA,C. RICARDO MORALES GONZÁLEZ
19010,1986,NA,C. MANUEL GARCÍA RODRÍGUEZ
19010,1989,NA,C. JOSÉ JUAN RAMÍREZ VIERA
19010,1992,PRI,LIC. ROLANDO HUGO GARCIA RODRIGUEZ
19010,1995,PRI,DR. ARTURO P. VILLARREAL GARCIA
19010,1997,PAN,C. FELIX GARZA AYALA
19010,2000,PRI,C. ELEAZAR LAZCANO ESCOBEDO
19010,2003,CAC,C. RUBEN DARIO VILLARREAL ANDRADE
19010,2006,PNA,C. FELIX GARZA AYALA
19010,2009,JXNL,C. ROLANDO HUGO GARCIA RODRIGUEZ
19010,2012,CPNL,C. ROGELIO ELIZONDO RUELAS
19010,2015,APTS,C. GERARDO ALFONSO DE LA MAZA VILLARREAL
19010,2018,COAL.,C. GERARDO ALFONSO DE LA MAZA VILLARREAL
19010,2021,COAL.,C. HUMBERTO MEDINA QUIRÓGA
19011,1939,NA,C. FÉLIX BENAVIDES BENAVIDES
19011,1940,NA,C. LUCAS QUINTANILLA SALINAS
19011,1943,NA,C. FLAVINO BENAVIDES BENAVIDES
19011,1946,NA,C. TORIBIO FLORES OSUNA
19011,1949,NA,C. ANTIOCO BENAVIDES GARZA
19011,1952,NA,C. CIPRIANO HINOJOSA RAMÍREZ
19011,1955,NA,C. MARTÍN ESCAMILLA GONZÁLEZ
19011,1958,NA,C. GERÓNIMO GARZA GONZÁLEZ
19011,1961,NA,C. CORNELIO GONZÁLEZ RAMOS
19011,1964,NA,C. JOSÉ INÉS GONZÁLEZ GUTIÉRREZ
19011,1967,NA,C. FILOMENO GONZÁLEZ SALINAS
19011,1970,NA,C. JOSÉ MARCOS GONZÁLEZ BENAVIDES
19011,1972,NA,C. RAMIRO GONZÁLEZ CHAPA
19011,1974,NA,C. IMELDA GARZA DE GONZÁLEZ
19011,1977,NA,C. FORTUNATO CAMPOS GONZÁLEZ
19011,1980,NA,C. JOSÉ G. GARZA
19011,1983,NA,C. LEONARDO CONTRERAS LÓPEZ
19011,1986,NA,LIC. JOSÉ LUIS GARZA GARCÍA
19011,1989,NA,C. ALEJANDRO BENAVIDES RAMOS
19011,1992,PRI,C. JOSE SANTOS MARTINEZ GUTIERREZ
19011,1995,PRI,C. JOSE AVELINO GUTIERREZ GUTIERREZ
19011,1997,PRI,C. CESAR RENE QUINTANILLA OSUNA
19011,2000,PRI,C. JOSE AVELINO GUTIERREZ GUTIERREZ
19011,2003,CAC,C. DOMINGO RIOS GUTIERREZ
19011,2006,AXM,C. EMMANUEL OVALLE LOPEZ
19011,2009,JXNL,C. JOSE ESTEVAN QUINTANILLA
19011,2012,CPNL,C. BLANCA CELIA FLORES MADRIGAL
19011,2015,PAN,C. BALTAZAR GILBERTO MARTINEZ RIOS
19011,2018,PAN,C. BALTAZAR GILBERTO MARTÍNEZ RÍOS
19011,2021,PAN,LIC. BALTAZAR MARTINEZ MONTEMAYOR
19012,1941,NA,C. DONACIANO DÍAZ CÁRDENAS
19012,1955,NA,C. RAÚL QUIROGA GARCÍA
19012,1964,NA,C. DONATO DÍAZ CÁRDENAS
19012,1970,NA,C. FRANCISCO PALACIOS RAMÍREZ
19012,1972,NA,C. LUIS ÁNGEL SÁENZ VILLARREAL
19012,1974,NA,C. AMBROSIO QUIROGA TREVIÑO
19012,1977,NA,C. CECILIO GARZA GARZA
19012,1980,NA,C. HÉCTOR BENITO RÍOS FLORES
19012,1983,NA,C. LORENZO SERNA ARREDONDO
19012,1986,NA,C. MIGUEL ÁNGEL CÁRDENAS DÁVILA
19012,1992,PRI,C. LUIS ANGEL SAENZ VILLAREAL
19012,1995,PRI,C. HOMERO QUIROGA DAVILA
19012,1997,PAN,C. JUAN JOSE CARDENAS VILLARREAL
19012,2000,PRI,ING. RAMON TREVIÑO TREVIÑO
19012,2003,CAC,C. BALTAZAR MARIO GALVAN LUJAN
19012,2006,COALICIÓN,C. MIGUEL ANGEL QUIROGA GARCIA
19012,2009,CONVER.,C. LEANDRO MONTEMAYOR RODRIGUEZ
19012,2012,PAN,C. JUAN RUBEN ESCAMILLA VARGAS
19012,2015,PRD,C. PEDRO ALONSO CASAS QUIÑONES
19012,2018,C.I.,C. PEDRO ALONSO CASAS QUIÑONES
19012,2021,COAL.,LIC. MIGUEL ANGEL QUIROGA TREVIÑO
19013,1939,NA,C. AURELIO GONZÁLEZ CHAPA
19013,1941,NA,C. MAURICIO CHAPA CHAPA
19013,1943,NA,C. ANTONIO LEAL GONZÁLEZ
19013,1946,NA,C. CAYETANO CHAPA TIJERINA
19013,1949,NA,C. CANUTO CHAPA GONZÁLEZ
19013,1952,NA,C. RAMES G. GONZÁLEZ
19013,1955,NA,C. MANUEL DE LEÓN
19013,1958,NA,C. ANACLETO GARCÍA
19013,1961,NA,C. FRANCISCO GONZÁLEZ LEAL
19013,1964,NA,C. GENARO LEAL GARZA
19013,1967,NA,C. JESÚS CHAPA TIJERINA
19013,1970,NA,C. RAÚL CANTÚ TIJERINA
19013,1972,NA,C. JESÚS MARTÍNEZ GONZÁLEZ
19013,1974,NA,C. JESÚS TIJERINA LOZANO
19013,1977,NA,C. ERNESTO TIJERINA CANTÚ
19013,1980,NA,C. GUSTAVO GONZÁLEZ TIJERINA
19013,1983,NA,C. LUIS MARIO GUAJARDO GUAJARDO
19013,1986,NA,C. J. CONCEPCIÓN LEAL GONZÁLEZ
19013,1989,NA,C. FRANCISCO GONZÁLEZ CANTÚ
19013,1992,PRI,C. OSCAR CANTU BAZAN
19013,1995,PRI,DR. GENARO LEAL MARTINEZ
19013,1997,PRI,C. NOE LEAL GONZALEZ
19013,2000,PRI,PROFR. OSCAR CANTU BAZAN
19013,2003,CAC,C. JAVIER ALONZO CHAPA CHAPA
19013,2006,AXM,C. JOSE FRANCISCO CANTU GUAJARDO
19013,2009,JXNL,C. JORGE GARZA SALINAS
19013,2012,CPNL,C. OSCAR CANTU GARZA
19013,2015,APTS,C. BUENAVENTURA TIJERINA CANTU
19013,2018,PNA,C. RAÚL KARR VÁZQUEZ
19013,2021,COAL.,PROFR. RAUL KARR VAZQUEZ
19014,1939,NA,C. JUAN N. GAYTÁN
19014,1941,NA,C. VENTURA MATA
19014,1943,NA,C. JOSÉ H. CERVANTES
19014,1945,NA,C. DESIDERIO N. MARTÍNEZ NARVÁEZ
19014,1947,NA,C. CANDELARIO CONTRERAS MARTÍNEZ
19014,1949,NA,C. MARGARITO TORRES REYNA
19014,1952,NA,C. JUAN REYNA LÓPEZ
19014,1955,NA,C. JUAN ELIMÓN BETANCOURT
19014,1958,NA,C. DUSTANO MUÑIZ LEIJA
19014,1961,NA,C. FELIPE LEDEZMA BULNES
19014,1964,NA,C. ALFONSO CASTILLO MUÑIZ
19014,1967,NA,C. ANATOLIO JARA VÁZQUEZ
19014,1970,NA,C. J. SANTOS CORTEZ GONZALEZ
19014,1972,NA,C. FRANCISCO BANDA LUCIO
19014,1974,NA,C. VIRGILIO REYNA MARTÍNEZ
19014,1977,NA,C. CARLOS MORALES SALINAS
19014,1980,NA,C. HONORIO COVARRUBIAS EURESTI
19014,1983,NA,C. DUSTANO MUÑIZ LEIJA
19014,1986,NA,C. ALFONSO CASTILLO MUÑIZ
19014,1989,NA,C. JUAN PAREDES GLORIA
19014,1992,PRI,ING. RAMON SALAS LOPEZ
19014,1995,PRI,C.P. JUAN PAREDES GLORIA
19014,1997,PRI,C. JOSE LUIS MUÑIZ ALVAREZ
19014,2000,PRI,LIC. JUAN FRANCISCO ESPINOZA EGUIA
19014,2003,CAC,C. RAMON SALAS LOPEZ
19014,2006,AXM,C. JUAN FRANCISCO ESPINOZA EGUIA
19014,2009,PAN,C. JESUS LARA CERVANTES
19014,2012,CPNL,C. JUAN FRANCISCO ESPINOZA EGUIA
19014,2015,PRI,C. JUAN ANTONIO MARTINEZ RODRIGUEZ
19014,2018,PRI,C. JUAN ANTONIO MARTÍNEZ RODRÍGUEZ
19014,2021,PRI,C. JUAN JOSE VARGAS ROSALES
19015,1919,NA,C. DVID PEÑA CANTÚ
19015,1939,NA,C. MARTÍN GONZÁLEZ HINOJOSA
19015,1941,NA,C. GONZAGA CANTA SALINAS
19015,1943,NA,C. GUMERSINDO RÍOS SALINAS
19015,1946,NA,C. RAMÓN HINOJOSA MARTÍNEZ
19015,1949,NA,C. ASENCIO MARTÍNEZ TRIGO
19015,1952,NA,C. ZARAGOZA RÍOS GARCÍA
19015,1955,NA,C. ARNULFO MADRIGAL SERNA
19015,1958,NA,C. DOMINGO PÉREZ ALANÍS
19015,1961,NA,C. FIDEL RÍOS CANTÚ
19015,1964,NA,C. LEANDRO SALINAS PEÑA
19015,1967,NA,C. SEVERIANO RÍOS CANTÚ
19015,1970,NA,C. PEDRO SALINAS TREVIÑO
19015,1972,NA,C. SIXTO GUTIÉRREZ RÍOS
19015,1974,NA,C. JUAN SALINAS CANTÚ
19015,1977,NA,C. RODOLFO HINOJOSA TIJERINA
19015,1980,NA,C. SIMÓN RÍOS BALDERAS
19015,1983,NA,C. MATÍAS LEAL RÍOS
19015,1986,NA,C. RENÉ SALINAS ALANÍS
19015,1989,NA,C. SIMÓN RÍOS BALDERAS
19015,1992,PRI,C. MARIA ELVA SALINAS DE HINOJOSA
19015,1995,PRI,C. GUADALUPE GARCIA HINOJOSA
19015,1997,PRI,C. DELIA RANGEL RIOS
19015,2000,PRI,LIC. JORGE ALBERTO CANTU CANTU
19015,2003,PAN,C. HOMERO ALANIS SALINAS
19015,2006,AXM,C. SIMON RIOS RANGEL
19015,2009,PAN,C. MIGUEL ANGEL SALINAS GONZALEZ
19015,2012,CPNL,C. JOSE GUADALUPE RIOS RIOS
19015,2015,PRI,C. SIMON RIOS RANGEL
19015,2018,PRI,C. SIMÓN RÍOS RANGEL
19015,2021,PNA,C. BERNARDO SOLIS ALANIS
19016,1939,NA,C. EDUARDO CHAPA GARZA
19016,1941,NA,C. AURELIO GUTIÉRREZ MARTÍNEZ
19016,1943,NA,C. LEOCADIO GONZÁLEZ GUTIÉRREZ
19016,1946,NA,C. LÁZARO PÁEZ
19016,1949,NA,C. TOMÁS MARTÍNEZ SALINAS
19016,1952,NA,C. JUAN ANTONIO CAMPOS DÍAZ
19016,1955,NA,C. JOSÉ CHAPA GARZA
19016,1958,NA,C. VICTORIANA MARTÍNEZ VDA. DE GARZA
19016,1961,NA,C. JUAN ANTONIO CAMPOS DÍAZ
19016,1964,NA,C. SANTIAGO MARTÍNEZ SALINAS
19016,1967,NA,C. RAMIRO GARZA CHAPA
19016,1970,NA,C. JUAN ANTONIO CAMPOS DÍAZ
19016,1972,NA,C. JOSÉ HÉCTOR MARTÍNEZ MARTÍNEZ
19016,1974,NA,C. EDUARDO MARTÍNEZ MARTÍNEZ
19016,1977,NA,C. TEODORO GARZA CHAPA
19016,1980,NA,C. JOSEFA GONZÁLEZ DE RUEDA
19016,1983,NA,C. RUBÉN GUTIÉRREZ GONZÁLEZ
19016,1986,NA,C. JUAN DE DIOS CHAPA CHAPA
19016,1989,NA,C. ARMANDO RODRÍGUEZ GONZÁLEZ
19016,1992,PRI,C. RAFAEL PAEZ MARTINEZ
19016,1995,PRI,C.P. FELIX ANGEL GUTIERREZ MARTINEZ
19016,1997,PRI,C. REYNALDO ESCAMILLA RODRIGUEZ
19016,2000,PRI,PROFR. JOSE ANGEL GUTIERREZ SALINAS
19016,2003,PT,C. JUAN JOSE PAEZ HERNANDEZ
19016,2006,PAN,C. ARTURO BOSQUES GONZALEZ
19016,2009,JXNL,C. PRISCILIANO RODRIGUEZ SALINAS
19016,2012,CPNL,C. JESUS ANGEL CUELLAR BARRIENTOS
19016,2015,CPYB,C. JUAN JOSE COSTILLA VILLA
19016,2018,COAL.,C. MAYRA ABREGO MONTEMAYOR
19016,2021,COAL.,LIC. MAYRA ABREGO MONTEMAYOR
19017,1919,NA,C. JOSÉ GONZÁLEZ PEÑA
19017,1939,NA,C. FÉLIX LUNA
19017,1941,NA,C. ELOY SOTO HINOJOSA
19017,1943,NA,C. MACARIO SOLÍS
19017,1946,NA,C. RAÚL MIER GAYTÁN
19017,1949,NA,C. J. REFUGIO SOLÍS
19017,1952,NA,C. ANASTASIO SANTANA MARTÍNEZ
19017,1955,NA,C. JOSÉ MARTÍNEZ DÍAZ
19017,1958,NA,C. AARÓN BARAJAS RUIZ
19017,1961,NA,C. ASCENCIÓN CHARLES LUNA
19017,1964,NA,C. LEOPOLDO ALEMÁN GARCÍA
19017,1967,NA,C. J. BELÉN MENDOZA GUZMÁN
19017,1970,NA,C. JUAN SALDAÑA MUÑIZ
19017,1972,NA,C. JOSÉ TORRES GÁMEZ
19017,1974,NA,C. JOSÉ SALAZAR REYNA
19017,1977,NA,C. ELEAZAR BAZALDÚA BAZALDÚA
19017,1980,NA,C. ROSALÍO PEÑA ROSALES
19017,1983,NA,C. JESÚS LUNA AGUILLÓN
19017,1986,NA,C. MARTÍN DE LEÓN ACOSTA
19017,1989,NA,C. JOSÉ CASTILLO CAMARILLO
19017,1992,PRI,C. GENARO RAMIREZ SALAS
19017,1994,PRI,ING. HELIODORO TIENDA GRIMALDO
19017,1995,PRI,ING. HELIODORO TIENDA GRIMALDO
19017,1997,PRI,C. CRECENCIO REYES TORRES
19017,2000,PRI,ING. FRANCISCO MORENO RESENDEZ
19017,2003,CAC,C. ALEJANDRO JAVIER PEDROZA FLORES
19017,2006,AXM,C. MARIO GARCIA DIAZ
19017,2009,JXNL,C. RAUL RAMIREZ CERDA
19017,2012,CPNL,C. JUAN ANTONIO MENDEZ BAZALDUA
19017,2015,PRI,C. ALEJANDRA RAMIREZ DIAZ
19017,2018,PRI,C. ALEJANDRA RAMÍREZ DÍAZ
19017,2021,COAL.,LIC. ALEJANDRO JAVIER PEDROZA FLORES
19018,1919,NA,C. SIMEÓN GARCÍA
19018,1942,NA,C. SALOMÓN SEPÚLVEDA G.
19018,1946,NA,C. SIMEÓN GARCÍA
19018,1949,NA,C. SERAPIO GARZA
19018,1950,NA,C. SALOMÓN SEPÚLVEDA G.
19018,1952,NA,C. GENARO GARZA G.
19018,1955,NA,C. JESÚS TREVIÑO S.
19018,1958,NA,C. FERNANDO NERIO
19018,1961,NA,C. PEDRO LOZANO CARVAJAL
19018,1964,NA,C. RAÚL GARZA GARCÍA
19018,1967,NA,C. LEONCIO GÁMEZ HERNÁNDEZ
19018,1970,NA,C. LUIS FERNÁNDEZ
19018,1972,NA,C. JESÚS GARZA GARZA
19018,1974,NA,C. RUBÉN TREVIÑO FERNÁNDEZ
19018,1977,NA,C. REYNALDO GARCÍA CANO
19018,1980,NA,C. ROLANDO RODRÍGUEZ FERNÁNDEZ
19018,1983,NA,C. MARÍA GUADALUPE ARELLANO FERNÁNDEZ
19018,1986,NA,C. RUBÉN S. NERIO RECIO
19018,1989,NA,C. MARTÍN DE J. GONZÁLEZ MARTÍNEZ
19018,1992,PRI,C.P. HECTOR SEPULVEDA DE LEON
19018,1995,PRI,LIC. CARLOS BARONA MORALES
19018,1997,COALICIÓN,C. EDUARDO ARGUIJO BALDENEGRO
19018,2000,COALICIÓN,C. RAUL AGUIRRE MONTES
19018,2003,CAC,C. MARCO ANTONIO HERNANDEZ ARIZPE
19018,2006,AXM,C. GUADALUPE ALEJANDRO VALADEZ ARRAMBIDE
19018,2009,JXNL,C. JAIME HELIODORO RODRIGUEZ CALDERON
19018,2012,CPNL,C. JESUS HERNANDEZ MARTINEZ
19018,2015,CI,C. CESAR ADRIAN VALDES MARTINEZ
19018,2018,C.I.,C. CARLOS ALBERTO GUEVARA GARZA
19018,2021,C.I.,C. CARLOS ALBERTO GUEVARA GARZA
19019,1939,NA,C. ELISEO MARTÍNEZ GARCÍA
19019,1941,NA,C. SILVANO GARZA IMPERIAL
19019,1942,NA,C. ARMANDO GONZÁLEZ VERÁSTEGUI
19019,1946,NA,C. MIGUEL PEREA VERÁSTEGUI
19019,1949,NA,C. ELISEO MARTÍNEZ GARCÍA
19019,1952,NA,C. JUAN FRANCISCO RODRÍGUEZ ARIZPE
19019,1955,NA,C. JOSÉ GONZÁLEZ VERÁSTEGUI
19019,1958,NA,C. LÁZARO GARZA AYALA JR.
19019,1961,NA,C. MANUEL MORALES ARIZPE
19019,1964,NA,C. HUMBERTO JUNCO V.
19019,1967,NA,C. NORMA VILLARREAL DE ZAMBRANO
19019,1970,NA,C. JESÚS D. GONZÁLEZ GONZÁLEZ
19019,1972,NA,C. BERNARDO DÁVILA REYES
19019,1974,NA,C. ENRIQUE GARCÍA LEAL
19019,1977,NA,C. GENARO LEAL MARTÍNEZ
19019,1980,NA,C. FELIPE ZAMBRANO PÁEZ
19019,1983,NA,C. RAÚL RANGEL HINOJOSA
19019,1986,NA,C. ALEJANDRO CHAPA SALAZAR
19019,1989,NA,C. MAURICIO FERNÁNDEZ GARZA
19019,1992,PAN,ING. ROGELIO SADA ZAMBRANO
19019,1995,PAN,C. FERNANDO MARGAIN BERLANGA
19019,1997,PAN,C. MARIA TERESA GARCIA SEGOVIA
19019,2000,PAN,ING. GERARDO GARZA SADA
19019,2003,PAN,C. ALEJANDRO ALBERTO C. PAEZ Y ARAGON
19019,2006,PAN,C. FERNANDO MARGAIN BERLANGA
19019,2009,PAN,ING. MAURICIO FERNANDEZ GARZA
19019,2012,PAN,C. ROBERTO UGO RUIZ CORTES
19019,2015,PAN,C. MAURICIO FERNANDEZ GARZA
19019,2021,C.I.,C. MIGUEL BERNARDO TREVIÑO DE HOYOS
19020,1949,NA,C. JUAN TIJERINA TIJERINA
19020,1952,NA,C. DONACIANO CANTÚ GONZÁLEZ
19020,1955,NA,C. IRINEO GARZA
19020,1958,NA,C. JULIÁN GONZÁLEZ LÓPEZ
19020,1961,NA,C. MANUEL RODRÍGUEZ
19020,1964,NA,C. POMPOSO G. PEÑA
19020,1967,NA,C. BENITO CANTÚ GARZA
19020,1970,NA,C. LUIS GARZA
19020,1972,NA,C. OSCAR TIJERINA DE LA GARZA
19020,1974,NA,C. LÁZARO QUINTANILLA GONZÁLEZ
19020,1977,NA,C. CONFERÍN ARIZPE RODRÍGUEZ
19020,1980,NA,C. GENARO TIJERINA GONZÁLEZ
19020,1983,NA,C. RUBÉN GONZÁLEZ GONZÁLEZ
19020,1986,NA,C. JUAN JAVIER CANTÚ VEGA
19020,1989,NA,C. SERGIO A. CANTÚ GARZA
19020,1992,PRI,C. FRANCISCO JAVIER GONZALEZ GONZALEZ
19020,1995,PRI,C. GENARO TIJERINA RODRIGUEZ
19020,1997,PRI,C. LUIS LAURO ESPINO RODRIGUEZ
19020,2000,PRI,PROFRA. MARIA GUADALUPE GUAJARDO PEREZ
19020,2003,CAC,C. ADOLFO CANTU SALINAS
19020,2006,AXM,C. J. CONCEPCION GARZA RODRIGUEZ
19020,2009,PAN,C. JULIO CESAR CANTU GRACIA
19020,2012,PAN,C. EDGAR CANTU FERNANDEZ
19020,2015,PAN,C. SOTERO GRACIA SALINAS
19020,2018,PAN,C. EDGAR CANTÚ FERNÁNDEZ
19020,2021,PAN,ING. EDGAR CANTU FERNANDEZ
19021,1919,NA,C. BONIFACIO VILLARREAL
19021,1939,NA,C. LUCIANO ESTRADA
19021,1941,NA,C. MARGARITO VILLARREAL
19021,1943,NA,C. JESÚS ELIZONDO SALDAÑA
19021,1946,NA,C. JOSÉ AYALA VILLARREAL
19021,1949,NA,C. MARCELO VILLARREAL
19021,1952,NA,C. LEONARDO RAMÍREZ V.
19021,1955,NA,C. FRANCISCO FLORES G.
19021,1958,NA,C. JULIÁN DOMÍNGUEZ VALDÉS
19021,1961,NA,C. JESÚS AYALA LÓPEZ
19021,1964,NA,C. LEOPOLDO CÁRDENAS L.
19021,1967,NA,C. LEONARDO VILLARREAL L.
19021,1970,NA,C. HÉCTOR J. AYALA V.
19021,1972,NA,C. JOSÉ MORALES CÁRDENAS
19021,1974,NA,C. SERGIO ELIZONDO CHAPA
19021,1977,NA,C. ALFONSO AYALA V.
19021,1980,NA,C. EULALIO VILLARREAL
19021,1983,NA,C. DONATO CHÁVEZ
19021,1986,NA,C. LEONEL CHÁVEZ RANGEL
19021,1989,NA,C. EULALIO VILLARREAL
19021,1992,PRI,ARQ. ABEL GUERRA GARZA
19021,1995,PRI,C. JESUS MANUEL MARTINEZ MARTINEZ
19021,1997,PRI,ARQ. ABEL GUERRA GARZA
19021,2000,PRI,C. LEONEL CHAVEZ RANGEL
19021,2003,CAC,C. FERNANDO RAFAEL MARGAIN SANTOS
19021,2006,AXM,C. MARGARITA MARTINEZ LOPEZ
19021,2009,JXNL,LIC. CLARA LUZ FLORES CARRALES
19021,2012,CPNL,C. CESAR GERARDO CAVAZOS CABALLERO
19021,2015,PRI,C. CLARA LUZ FLORES CARRALES
19021,2018,PRI,C. CLARA LUZ FLORES CARRALES
19021,2020,-,C. JOSE ANTONIO QUIROGA CHAPA
19021,2021,COAL.,C. ANDRES CONCEPCION MIJES LLOVERA
19022,1919,NA,C. GUADALUPE LOZANO GARCÍA
19022,1939,NA,C. FELIPE GUAJARDO TREVIÑO
19022,1943,NA,C. ANTONIO ELIZONDO CAVAZOS
19022,1946,NA,C. IGNACIO CANTÚ GARZA
19022,1949,NA,C. FELIPE GUAJARDO TREVIÑO
19022,1952,NA,C. JUAN FLORES GARZA
19022,1955,NA,C. ELÍAS ANCER VITAR
